"Title","Journal.Name","Pub.Year","DOI","Doc.Type","OA.Flag","OA.Color"
"One-year results with a low-profile endograft in subjects with thoracic aortic aneurysm and ulcer pathologies.","The Journal of thoracic and cardiovascular surgery","2022","10.1016/j.jtcvs.2021.10.071","journal article","TRUE","green"
"Long-term Burosumab Administration Is Safe and Effective in Adults With X-linked Hypophosphatemia.","The Journal of clinical endocrinology and metabolism","2022","10.1210/clinem/dgac518","journal article","TRUE","hybrid"
"Pediatric ventilator liberation, systemic corticosteroids, and endotracheal tube air leak test (CINAHL).","searchRxiv","2022","10.1079/searchrxiv.2022.00074","journal article","TRUE","hybrid"
"Phylogenomics, epigenomics, virulome and mobilome of Gram-negative bacteria co-resistant to carbapenems and polymyxins: a One Health systematic review and meta-analyses.","Environmental microbiology","2022","10.1111/1462-2920.15930","journal article","TRUE","green"
"USER PERSONAS TO GUIDE TECHNOLOGY INTERVENTION DESIGN TO SUPPORT CAREGIVER-ASSISTED MEDICATION MANAGEMENT","Innovation in Aging","2022","10.1093/geroni/igac059.2780","journal article","TRUE","gold"
"Obesity and exercise training alter inflammatory pathway skeletal muscle small extracellular vesicle microRNAs.","Experimental physiology","2022","10.1113/ep090062","journal article","TRUE","green"
"Association of a Positive Drug Screening for Cannabis With Mortality and Hospital Visits Among Veterans Affairs Enrollees Prescribed Opioids.","JAMA network open","2022","10.1001/jamanetworkopen.2022.47201","journal article","TRUE","gold"
"Computational, Experimental, and Clinical Evidence of a Specific but Peculiar Evolutionary Nature of (COVID-19) SARS-CoV-2.","Journal of proteome research","2022","10.1021/acs.jproteome.2c00001","journal article","TRUE","green"
"A novel decellularized matrix of Wnt signaling-activated osteocytes accelerates the repair of critical-sized parietal bone defects with osteoclastogenesis, angiogenesis, and neurogenesis.","Bioactive materials","2022","10.1016/j.bioactmat.2022.07.017","journal article","TRUE","gold"
"Pathophysiology of Acute Kidney Injury in Malaria and Non-Malarial Febrile Illness: A Prospective Cohort Study.","Pathogens (Basel, Switzerland)","2022","10.3390/pathogens11040436","journal article","TRUE","gold"
"Preparing for the spread of patient-reported outcome (PRO) data collection from primary care to community pharmacy: a mixed-methods study.","Implementation science communications","2022","10.1186/s43058-022-00277-3","journal article","TRUE","gold"
"Practice trends for perioperative intravesical chemotherapy in upper tract urothelial carcinoma: Low but increasing utilization during minimally invasive nephroureterectomy.","Urologic oncology","2022","10.1016/j.urolonc.2022.06.006","journal article","FALSE",NA
"Effect of Burosumab Compared With Conventional Therapy on Younger vs Older Children With X-linked Hypophosphatemia.","The Journal of clinical endocrinology and metabolism","2022","10.1210/clinem/dgac296","journal article","TRUE","hybrid"
"Lighting up Nobel Prize-winning studies with protein intrinsic disorder.","Cellular and molecular life sciences : CMLS","2022","10.1007/s00018-022-04468-y","journal article","FALSE",NA
"Healthcare Transition Among Young Adults With Childhood-Onset Chronic Pain: A Mixed Methods Study and Proposed Framework.","The journal of pain","2022","10.1016/j.jpain.2022.02.010","journal article","TRUE","hybrid"
"USP14 promotes tryptophan metabolism and immune suppression by stabilizing IDO1 in colorectal cancer.","Nature communications","2022","10.1038/s41467-022-33285-x","journal article","TRUE","gold"
"The effect of curricular reform on gross anatomy laboratory examination performance: An institutional analysis.","Anatomical sciences education","2022","10.1002/ase.2201","journal article","TRUE","bronze"
"Experimental models of acute kidney injury for translational research.","Nature reviews. Nephrology","2022","10.1038/s41581-022-00539-2","journal article","FALSE",NA
"Fluid Homeostasis and Diuretic Therapy in the Neonate.","NeoReviews","2022","10.1542/neo.23-3-e189","journal article","FALSE",NA
"Anemia and fibroblast growth factor 23 elevation in chronic kidney disease: homeostatic interactions and emerging therapeutics.","Current opinion in nephrology and hypertension","2022","10.1097/mnh.0000000000000797","journal article","TRUE","green"
"ER Disposal Pathways in Chronic Liver Disease: Protective, Pathogenic, and Potential Therapeutic Targets.","Frontiers in molecular biosciences","2022","10.3389/fmolb.2021.804097","journal article","TRUE","gold"
"Shape Memory Polymer-Based Endovascular Devices: Design Criteria and Future Perspective.","Polymers","2022","10.3390/polym14132526","journal article","TRUE","gold"
"Creating profiles of juvenile offenders using functions of aggression and callous-unemotional traits: relations to crime type.","Psychiatry, psychology, and law : an interdisciplinary journal of the Australian and New Zealand Association of Psychiatry, Psychology and Law","2022","10.1080/13218719.2022.2116609","journal article","TRUE",NA
"Using Best-Worst Scaling to investigate younger adult Canadians' preferences for COVID-19 vaccination and public health measures: An observational study.","Preventive medicine reports","2022","10.1016/j.pmedr.2022.101755","journal article","TRUE","gold"
"A Novel 2-Hit Zebrafish Model to Study Early Pathogenesis of Non-Alcoholic Fatty Liver Disease.","Biomedicines","2022","10.3390/biomedicines10020479","journal article","TRUE","gold"
"The Temporal Relationship Between Local School Closure and Increased Incidence of Pediatric Diabetic Ketoacidosis.","Frontiers in pediatrics","2022","10.3389/fped.2022.812265","journal article","TRUE","gold"
"Proteophenes - Amino Acid Functionalized Thiophene-based Fluorescent Ligands for Visualization of Protein Deposits in Tissue Sections with Alzheimer's Disease Pathology.","Chemistry (Weinheim an der Bergstrasse, Germany)","2022","10.1002/chem.202201557","journal article","TRUE","hybrid"
"Metabolomic and lipidomic signatures in autosomal dominant and late-onset Alzheimer's disease brains.","Alzheimer's & dementia : the journal of the Alzheimer's Association","2022","10.1002/alz.12800","journal article","TRUE","hybrid"
"A randomized controlled pilot trial of video-modelling versus telementoring for improved hemorrhage control wound packing.","American journal of surgery","2022","10.1016/j.amjsurg.2022.02.039","journal article","FALSE",NA
"Associations between longitudinal changes in sleep disturbance and depressive and anxiety symptoms during the COVID-19 virus pandemic among older women with and without breast cancer in the thinking and living with breast cancer study.","Cancer medicine","2022","10.1002/cam4.4682","journal article","TRUE","gold"
"Skeletal muscle coverage in undergraduate courses: a comparison of stand-alone human anatomy and anatomy and physiology (A&P) courses.","Advances in physiology education","2022","10.1152/advan.00038.2022","journal article","TRUE","gold"
"Melatonin and andrographolide synergize to inhibit the colospheroid phenotype by targeting Wnt/beta-catenin signaling.","Journal of pineal research","2022","10.1111/jpi.12808","journal article","TRUE","green"
"Cochlear Duct Abnormalities in Mice With Osteogenesis Imperfecta","The FASEB Journal","2022","10.1096/fasebj.2022.36.s1.r4774","journal article","FALSE",NA
"Corrigendum: Yoga, Meditation and Mind-Body Health: Increased BDNF, Cortisol Awakening Response, and Altered Inflammatory Marker Expression After a 3-Month Yoga and Meditation Retreat.","Frontiers in human neuroscience","2022","10.3389/fnhum.2022.868021","journal article","TRUE","gold"
"For the Birds: Radiology Parallels, Finding Wellness, and Lessons Learned in Birding.","Academic radiology","2022","10.1016/j.acra.2021.12.023","journal article","FALSE",NA
"Tele-Neuro-Ophthalmology Utilization, Availability, and Attitudes: Update 1 Year Into the COVID-19 Public Health Emergency.","Journal of neuro-ophthalmology : the official journal of the North American Neuro-Ophthalmology Society","2022","10.1097/wno.0000000000001663","journal article","TRUE","green"
"The impact of resource facilitation on recidivism for individuals with traumatic brain injury: A pilot, non-randomized controlled study.","Brain injury","2022","10.1080/02699052.2022.2051207","journal article","FALSE",NA
"Patient and Care Partner Burden in CKD Patients With and Without Anemia: A US-Based Survey.","Kidney medicine","2022","10.1016/j.xkme.2022.100439","journal article","TRUE","gold"
"Investigating Health Disparities Associated With Multisystem Inflammatory Syndrome in Children After SARS-CoV-2 Infection.","The Pediatric infectious disease journal","2022","10.1097/inf.0000000000003689","journal article","TRUE","hybrid"
"A Study on the Nature of SARS-CoV-2 Using the Shell Disorder Models: Reproducibility, Evolution, Spread, and Attenuation.","Biomolecules","2022","10.3390/biom12101353","journal article","TRUE","gold"
"Primary Repair of Chronic Distal Biceps Tendon Tears.","Hand (New York, N.Y.)","2022","10.1177/15589447221107691","journal article","FALSE",NA
"Evaluating the risk of peri-umbilical hernia after sutured or sutureless gastroschisis closure.","Journal of pediatric surgery","2022","10.1016/j.jpedsurg.2022.03.019","journal article","FALSE",NA
"Are EPB41 and alpha-synuclein diagnostic biomarkers of sport-related concussion? Findings from the NCAA and Department of Defense CARE Consortium.","Journal of sport and health science","2022","10.1016/j.jshs.2022.11.007","journal article","TRUE","gold"
"Botulinum toxin injection in masseter muscle evokes musculoskeletal impairment of the masticatory system","The FASEB Journal","2022","10.1096/fasebj.2022.36.s1.r4788","journal article","TRUE","bronze"
"Optimizing Concussion Care Seeking: The Influence of Previous Concussion Diagnosis Status on Baseline Assessment Outcomes.","The American journal of sports medicine","2022","10.1177/03635465221118089","journal article","FALSE",NA
"Value of liver biopsy in the diagnosis of drug-induced liver injury.","Journal of hepatology","2022","10.1016/j.jhep.2021.12.043","journal article","TRUE","hybrid"
"Racial-ethnic variations in phyllodes tumors among a multicenter United States cohort.","Journal of surgical oncology","2022","10.1002/jso.27117","journal article","FALSE",NA
"The silent tragic reality of Hidden Hunger, anaemia, and neural-tube defects (NTDs) in India.","The Lancet regional health. Southeast Asia","2022","10.1016/j.lansea.2022.100071","journal article","TRUE","gold"
"The right time for ischemic time?","Journal of cardiac surgery","2022","10.1111/jocs.16557","journal article","FALSE",NA
"Virtual learning impacts communication and teamwork.","The clinical teacher","2022","10.1111/tct.13514","journal article","TRUE","green"
"Gene therapy access: Global challenges, opportunities, and views from Brazil, South Africa, and India.","Molecular therapy : the journal of the American Society of Gene Therapy","2022","10.1016/j.ymthe.2022.04.002","journal article","TRUE","hybrid"
"D-cysteine ethyl ester and D-cystine dimethyl ester reverse the deleterious effects of morphine on arterial blood-gas chemistry and Alveolar-arterial gradient in anesthetized rats.","Respiratory physiology & neurobiology","2022","10.1016/j.resp.2022.103912","journal article","TRUE","hybrid"
"Medical countermeasures for the hematopoietic-subsyndrome of acute radiation syndrome in space.","Life sciences in space research","2022","10.1016/j.lssr.2022.06.002","journal article","TRUE","hybrid"
"Doomscrolling during COVID-19: The negative association between daily social and traditional media consumption and mental health symptoms during the COVID-19 pandemic.","Psychological trauma : theory, research, practice and policy","2022","10.1037/tra0001202","journal article","TRUE","green"
"Diagnosis and Management of Uncomplicated Chlamydia trachomatis Infections in Adolescents and Adults: Summary of Evidence Reviewed for the 2021 Centers for Disease Control and Prevention Sexually Transmitted Infections Treatment Guidelines.","Clinical infectious diseases : an official publication of the Infectious Diseases Society of America","2022","10.1093/cid/ciac126","journal article","TRUE","bronze"
"Suppression of breast cancer-associated bone loss with osteoblast proteomes via Hsp90ab1/moesin-mediated inhibition of TGFβ/FN1/CD44 signaling.","Theranostics","2022","10.7150/thno.66148","journal article","TRUE","gold"
"COVID-19 and other respiratory tract infections at mass gathering religious and sporting events.","Current opinion in pulmonary medicine","2022","10.1097/mcp.0000000000000859","journal article","FALSE",NA
"Identification of Key Determinants of Cerebral Malaria Development and Inhibition Pathways.","mBio","2022","10.1128/mbio.03708-21","journal article","TRUE","gold"
"An Exploration of Metacognitive Practices in Gross Anatomy Educators","The FASEB Journal","2022","10.1096/fasebj.2022.36.s1.r2386","journal article","FALSE",NA
"Pediatric ventilator liberation, systemic corticosteroids, and endotracheal tube air leak test (Embase).","searchRxiv","2022","10.1079/searchrxiv.2022.00073","journal article","TRUE","hybrid"
"Clinicians' Use of Quantitative Information while Assessing the Rate of Functional Progression in Glaucoma.","Ophthalmology. Glaucoma","2022","10.1016/j.ogla.2022.03.002","journal article","TRUE",NA
"Pediatric ventilator liberation, systemic corticosteroids, and endotracheal tube air leak test (MEDLINE).","searchRxiv","2022","10.1079/searchrxiv.2022.00065","journal article","TRUE","hybrid"
"Intrinsically disordered proteins play diverse roles in cell signaling.","Cell communication and signaling : CCS","2022","10.1186/s12964-022-00821-7","journal article","TRUE","gold"
"1288. US Healthcare Provider Perspectives on the initiation of cabotegravir and rilpivirine long-acting (CAB+RPV LA) in an observational real-world study (BEYOND)","Open Forum Infectious Diseases","2022","10.1093/ofid/ofac492.1119","journal article","TRUE","gold"
"Differences in Patient Outcomes Across the PFF Care Center Network","B22. EMERGING MANAGEMENT OF FIBROTIC ILDs","2022","10.1164/ajrccm-conference.2022.205.1_meetingabstracts.a5573","conference proceedings article","FALSE",NA
"Isoniazid preventive therapy and tuberculosis transcriptional signatures in people with HIV.","AIDS (London, England)","2022","10.1097/qad.0000000000003262","journal article","TRUE","green"
"Simulation-Optimization to Distinguish Optimal Symptom Free Waiting Period for Return-to-Play Decisions in Sport-Related Concussion","2022 Winter Simulation Conference (WSC)","2022","10.1109/wsc57314.2022.10015285","conference proceedings article","FALSE",NA
"Corrigendum: Assessment of histotripsy-induced liquefaction with diagnostic ultrasound and magnetic resonance imagingin vitroandex vivo(2019Phys. Med. Biol.64095023).","Physics in medicine and biology","2022","10.1088/1361-6560/ac92b8","journal article","TRUE","bronze"
"Acinetobacter quorum sensing contributes to inflammation-induced inhibition of orthopaedic implant osseointegration.","European cells & materials","2022","10.22203/ecm.v043a18","journal article","TRUE","gold"
"Risk and Outcome of Breakthrough COVID-19 Infections in Vaccinated Patients With Cancer: Real-World Evidence From the National COVID Cohort Collaborative.","Journal of clinical oncology : official journal of the American Society of Clinical Oncology","2022","10.1200/jco.21.02419","journal article","TRUE","hybrid"
"Gains in Daily Stepping Activity in People With Chronic Stroke After High-Intensity Gait Training in Variable Contexts.","Physical therapy","2022","10.1093/ptj/pzac073","journal article","TRUE","green"
"Results of Low Distal Femur Periprosthetic Fractures.","Journal of orthopaedic trauma","2022","10.1097/bot.0000000000002352","journal article","TRUE","green"
"Improved Cell-Potent and Selective Peptidomimetic Inhibitors of Protein N-Terminal Methyltransferase 1.","Molecules (Basel, Switzerland)","2022","10.3390/molecules27041381","journal article","TRUE","gold"
"Measuring Stroke Quality: Methodological Considerations in Selecting, Defining, and Analyzing Quality Measures.","Stroke","2022","10.1161/strokeaha.122.036485","journal article","FALSE",NA
"Gastrointestinal Endoscopy-Associated Infections: Update on an Emerging Issue.","Digestive diseases and sciences","2022","10.1007/s10620-022-07441-8","journal article","FALSE",NA
"Training the next generation of learning health system scientists.","Learning health systems","2022","10.1002/lrh2.10342","journal article","TRUE","gold"
"Murine Gut Microbiome Meta-analysis Reveals Alterations in Carbohydrate Metabolism in Response to Aging.","mSystems","2022","10.1128/msystems.01248-21","journal article","TRUE","gold"
"Age stratified sex-related differences in incidence, management, and outcomes of cardiogenic shock.","Catheterization and cardiovascular interventions : official journal of the Society for Cardiac Angiography & Interventions","2022","10.1002/ccd.30177","journal article","FALSE",NA
"Clustering of Covid-19 infections among healthcare workers: Experience from a tertiary care center in Saudi Arabia.","American journal of infection control","2022","10.1016/j.ajic.2022.06.007","journal article","TRUE","green"
"Enhanced recovery after surgery multimodality pain regimen performs similar to PRN narcotics on outcomes and pain control after cardiac surgery: A quality improvement project.","Journal of cardiac surgery","2022","10.1111/jocs.16458","journal article","TRUE","gold"
"Thymoma and pure red cell aplasia: A single institution experience.","Journal of Clinical Oncology","2022","10.1200/jco.2022.40.16_suppl.e20625","journal article","FALSE",NA
"Two Instrument Comparison of Reagents From a US FDA-Approved Assay for the Assessment of Ki-67 in High-Risk Early Breast Cancer.","Applied immunohistochemistry & molecular morphology : AIMM","2022","10.1097/pai.0000000000001050","journal article","TRUE","hybrid"
"SYMPTOM BURDEN AND QUALITY OF LIFE FOR NURSING HOME RESIDENTS WITH DEMENTIA: UPLIFT TRIAL EARLY DATA","Innovation in Aging","2022","10.1093/geroni/igac059.194","journal article","TRUE","gold"
"Preliminary analysis of coronavirus disease 2019 variable insertion into Vascular Quality Initiative registries.","Journal of vascular surgery","2022","10.1016/j.jvs.2022.06.009","journal article","TRUE","bronze"
"Delphi Initiative for Early-Onset Colorectal Cancer (DIRECt) International Management Guidelines.","Clinical gastroenterology and hepatology : the official clinical practice journal of the American Gastroenterological Association","2022","10.1016/j.cgh.2022.12.006","journal article","TRUE","hybrid"
"Malnutrition screening and treatment in pediatric oncology: a scoping review.","BMC nutrition","2022","10.1186/s40795-022-00643-3","journal article","TRUE","gold"
"Approximating subject-specific brain injury models via scaling based on head-brain morphological relationships.","Biomechanics and modeling in mechanobiology","2022","10.1007/s10237-022-01638-6","journal article","FALSE",NA
"Histopathology of Prostate Cancer and its Precursors.","Applied immunohistochemistry & molecular morphology : AIMM","2022","10.1097/pai.0000000000001067","journal article","FALSE",NA
"HUNK Regulation of Interleukin 4 in Triple Negative Breast Cancer","The FASEB Journal","2022","10.1096/fasebj.2022.36.s1.r2558","journal article","FALSE",NA
"Malaria.","JAMA","2022","10.1001/jama.2021.21468","journal article","TRUE","bronze"
"The #PedsMatch21 Webinar Series: Coordinated Specialty-Level Communication During the Virtual Residency Application Cycle.","Academic medicine : journal of the Association of American Medical Colleges","2022","10.1097/acm.0000000000004623","journal article","TRUE","bronze"
"Differences in functional connectivity distribution after transcranial direct-current stimulation: A connectivity density point of view.","Human brain mapping","2022","10.1002/hbm.26112","journal article","TRUE","gold"
"What can monkey fossils tell us about early human evolution? New insights from the analysis of molar cusp proportions in fossil cercopithecoids from Laetoli, Tanzania","The FASEB Journal","2022","10.1096/fasebj.2022.36.s1.r4596","journal article","FALSE",NA
"Fragmentation of Stones by Burst Wave Lithotripsy in the First 19 Humans.","The Journal of urology","2022","10.1097/ju.0000000000002446","journal article","TRUE","green"
"Clinicopathologic and Immunohistochemical Characterization of Sarcomatoid Chromophobe Renal Cell Carcinoma: An Analysis of 22 Cases.","The American journal of surgical pathology","2022","10.1097/pas.0000000000001926","journal article","FALSE",NA
"Spinal column shortening for tethered cord syndrome: a systematic review and individual patient data meta-analysis.","Journal of neurosurgery. Pediatrics","2022","10.3171/2022.1.peds21503","journal article","FALSE",NA
"Surgical Management of Craniovertebral Junction Schwannomas: A Systematic Review.","Current oncology (Toronto, Ont.)","2022","10.3390/curroncol29070384","journal article","TRUE","gold"
"Incidence, Survival Analysis and Future Perspective of Primary Peritoneal Mesothelioma (PPM): A Population-Based Study from SEER Database.","Cancers","2022","10.3390/cancers14040942","journal article","TRUE","gold"
"Engineered natural killer cells impede the immunometabolic CD73-adenosine axis in solid tumors.","eLife","2022","10.7554/elife.73699","journal article","TRUE","gold"
"Dental Tissue Volumes in Mice with Osteogenesis Imperfecta","The FASEB Journal","2022","10.1096/fasebj.2022.36.s1.r6297","journal article","FALSE",NA
"CD4+ progenitor cells sustain helper responses during chronic infection.","Immunity","2022","10.1016/j.immuni.2022.06.016","journal article","FALSE",NA
"Modern indications for referral for kidney and pancreas transplantation.","Current opinion in nephrology and hypertension","2022","10.1097/mnh.0000000000000846","journal article","FALSE",NA
"Physiology-Enhanced Data Analytics to Evaluate the Effect of Altitude on Intraocular Pressure and Ocular Hemodynamics.","Photonics","2022","10.3390/photonics9030158","journal article","TRUE","gold"
"Risk of total metachronous advanced neoplasia in patients with both small tubular adenomas and serrated polyps.","Gastrointestinal endoscopy","2022","10.1016/j.gie.2022.02.015","journal article","FALSE",NA
"Obesity-induced galectin-9 is a therapeutic target in B-cell acute lymphoblastic leukemia.","Nature communications","2022","10.1038/s41467-022-28839-y","journal article","TRUE","gold"
"Blimp1 controls GC B cell expansion and exit through regulating cell cycle progression and key transcription factors BCL6 and IRF4","The Journal of Immunology","2022","10.4049/jimmunol.208.supp.112.06","journal article","FALSE",NA
"Reporting Essentials for DElirium bioMarker Studies (REDEEMS): Explanation and Elaboration","Delirium Communications","2022","10.56392/001c.57389","journal article","TRUE","bronze"
"Teaching with Technology-Matching Pedagogy with Purpose in Radiology Education.","Academic radiology","2022","10.1016/j.acra.2022.03.019","journal article","FALSE",NA
"0538 ""Something is Wrong!"" A Qualitative Study of Racial Disparities in Parental Experiences of OSA Detection among Their Children","Sleep","2022","10.1093/sleep/zsac079.535","journal article","TRUE","bronze"
"Filling the Gap: Creating a Student-Run LGBT+ Clinic to Address Health Disparities.","Academic medicine : journal of the Association of American Medical Colleges","2022","10.1097/acm.0000000000004466","journal article","TRUE","bronze"
"Get SET Early autism screening program.","The Journal of pediatrics","2022","10.1016/j.jpeds.2021.10.041","journal article","TRUE","bronze"
"Gastrointestinal Stromal Tumors (GIST): A Population-Based Study Using the SEER Database, including Management and Recent Advances in Targeted Therapy.","Cancers","2022","10.3390/cancers14153689","journal article","TRUE","gold"
"Noncanonical PDK4 action alters mitochondrial dynamics to affect the cellular respiratory status.","Proceedings of the National Academy of Sciences of the United States of America","2022","10.1073/pnas.2120157119","journal article","TRUE","hybrid"
"Neuronal cilia in energy homeostasis.","Frontiers in cell and developmental biology","2022","10.3389/fcell.2022.1082141","journal article","TRUE","gold"
"Disruption of Kidney-Immune System Crosstalk in Sepsis with Acute Kidney Injury: Lessons Learned from Animal Models and Their Application to Human Health.","International journal of molecular sciences","2022","10.3390/ijms23031702","journal article","TRUE","gold"
"Advances in Stroke: Quality Improvement.","Stroke","2022","10.1161/strokeaha.122.037450","journal article","TRUE","bronze"
"Impact of new-onset versus pre-existing atrial fibrillation on outcomes after transcatheter aortic valve replacement/implantation.","International journal of cardiology. Heart & vasculature","2022","10.1016/j.ijcha.2021.100910","journal article","TRUE","gold"
"Screening for Kidney Disease in Low- and Middle-Income Countries.","Seminars in nephrology","2022","10.1016/j.semnephrol.2023.151315","journal article","FALSE",NA
"ASO Author Reflections: Expectations in Axillary Lymph Node Dissections After Neoadjuvant Chemotherapy.","Annals of surgical oncology","2022","10.1245/s10434-022-12636-4","journal article","FALSE",NA
"Shifting tides: reflecting on medical education in the time of covid-19.","BMJ (Clinical research ed.)","2022","10.1136/bmj.o657","journal article","TRUE","bronze"
