"Title","Journal.Name","Pub.Year","DOI","Doc.Type","OA.Flag","OA.Color"
"0541 Auto PAP adherence determinants of children during the pandemic: A single center experience","Sleep","2022","10.1093/sleep/zsac079.538","journal article","TRUE","bronze"
"Implementation of Integrated Dual Disorder Treatment in Routine Veterans Health Administration Settings","International Journal of Mental Health and Addiction","2022","10.1007/s11469-022-00891-1","journal article","FALSE",NA
"Association of Lymph Node Count and Survival after Primary Retroperitoneal Lymphadenectomy for Nonseminomatous Testicular Cancer.","The Journal of urology","2022","10.1097/ju.0000000000002369","journal article","FALSE",NA
"Distribution Of Parent Occupations Among Ncaa Student-athletes: Findings From The Ncaa-dod Care Consortium","Medicine & Science in Sports & Exercise","2022","10.1249/01.mss.0000878336.17489.ba","journal article","TRUE","bronze"
"Understanding student-lead charitable events through participant social media usage: A mixed-methods study","Events and Tourism Review","2022","10.18060/26289","journal article","TRUE","gold"
"Health Impairments in Children and Adolescents After Hospitalization for Acute COVID-19 or MIS-C.","Pediatrics","2022","10.1542/peds.2022-057798","journal article","TRUE","green"
"Comparison Between Dance-based And Traditional Exercise On Health-related Quality Of Life: A Cross-sectional Analysis","Medicine & Science in Sports & Exercise","2022","10.1249/01.mss.0000877692.11041.47","journal article","TRUE","bronze"
"Impact of Sex and Gender on Autoimmune Lung Disease: Opportunities for Future Research: NHLBI Working Group Report.","American journal of respiratory and critical care medicine","2022","10.1164/rccm.202112-2746pp","journal article","TRUE","green"
"The Use and Duration of Preintubation Respiratory Support Is Associated With Increased Mortality in Immunocompromised Children With Acute Respiratory Failure.","Critical care medicine","2022","10.1097/ccm.0000000000005535","journal article","TRUE","green"
"Periconceptional diet quality is associated with gestational diabetes risk and glucose concentrations among nulliparous gravidas.","Frontiers in endocrinology","2022","10.3389/fendo.2022.940870","journal article","TRUE","gold"
"Influence of Staphylococcus aureus Strain Background on Sa3int Phage Life Cycle Switches.","Viruses","2022","10.3390/v14112471","journal article","TRUE","gold"
"The Lumping/Splitting Conversation Related to Fibromyalgia in Rheumatology: Does It Matter?","Rheumato","2022","10.3390/rheumato2030007","journal article","TRUE","gold"
"Reducing Geographic Barriers for Breast Cancer Diagnosis","JCO Global Oncology","2022","10.1200/go.22.55000","journal article","TRUE","gold"
"891P Naxitamab treatment for relapsed or refractory high-risk neuroblastoma: Outcomes from the first prespecified analyses of the Pivotal 201 Trial","Annals of Oncology","2022","10.1016/j.annonc.2022.07.1017","journal article","TRUE","hybrid"
"Acupuncture improves the symptoms, intestinal microbiota, and inflammation of patients with mild to moderate Crohn's disease: A randomized controlled trial.","EClinicalMedicine","2022","10.1016/j.eclinm.2022.101300","journal article","TRUE","gold"
"Staphylococcus aureus and Acinetobacter baumannii Inhibit Osseointegration of Orthopedic Implants.","Infection and immunity","2022","10.1128/iai.00669-21","journal article","TRUE","green"
"Soluble α-klotho and heparin modulate the pathologic cardiac actions of fibroblast growth factor 23 in chronic kidney disease.","Kidney international","2022","10.1016/j.kint.2022.03.028","journal article","TRUE","hybrid"
"ASTCT Clinical Practice Recommendations for Transplantation and Cellular Therapies in Multiple Myeloma.","Transplantation and cellular therapy","2022","10.1016/j.jtct.2022.03.019","journal article","TRUE","hybrid"
"ISPAD Clinical Practice Consensus Guidelines 2022: Editorial.","Pediatric diabetes","2022","10.1111/pedi.13441","journal article","TRUE","gold"
"Investigation of Total Concentration of Mercury in Road Sediment in Michigan City, Indiana: A New Type of Environmental Record of Pollution and Complexities","SSRN Electronic Journal","2022","10.2139/ssrn.4288755","journal article","FALSE",NA
"Meaningful Writing Assignments in a Graduate Certificate Program Practicum","Prompt: A Journal of Academic Writing Assignments","2022","10.31719/pjaw.v6i2.81","journal article","TRUE","gold"
"Expression Level and Biomarker Potential of Hemoxygenase-1 in Pancreatic Cancer","International Journal of Radiation Oncology*Biology*Physics","2022","10.1016/j.ijrobp.2022.07.1104","journal article","FALSE",NA
"O-013 Safety and efficacy of MCA M2 thrombectomy in delayed time window (>6 hours): a propensity score analysis from the STAR registry","SNIS 19th annual meeting oral abstracts","2022","10.1136/neurintsurg-2022-snis.13","conference proceedings article","TRUE","bronze"
"Wuzi Yanzong Pill relieves CPZ-induced demyelination by improving the microenvironment in the brain.","Heliyon","2022","10.1016/j.heliyon.2022.e12277","journal article","TRUE","gold"
"SPINE: An Initiative to Reduce Pressure Sore Recurrence.","Plastic and reconstructive surgery. Global open","2022","10.1097/gox.0000000000004625","journal article","TRUE","gold"
"234 Analyzing the Quality of YouTube Videos on Inflatable Penile Prosthesis Surgery","The Journal of Sexual Medicine","2022","10.1016/j.jsxm.2022.01.248","journal article","FALSE",NA
"A-type FHFs mediate resurgent currents through TTX-resistant voltage-gated sodium channels.","eLife","2022","10.7554/elife.77558","journal article","TRUE","gold"
"Association Between Anxiety Symptoms, Depression Symptoms, and Life Satisfaction Among Individuals 1 Year After Spinal Cord Injury: Findings From the SCIRehab Project.","Archives of rehabilitation research and clinical translation","2022","10.1016/j.arrct.2022.100211","journal article","TRUE","gold"
"191P Correlation of early change in standardized uptake value (SUV) on positron emission tomography (PET/CT) with recurrence-free survival (RFS) and overall survival (OS) in patients with primary operable HER2-positive breast cancer (TBCRC026)","Annals of Oncology","2022","10.1016/j.annonc.2022.07.226","journal article","TRUE","hybrid"
"Cognitive and Behavioral Outcomes in Male and Female NCAA Soccer Athletes across Multiple Years: A CARE Consortium Study.","Medicine and science in sports and exercise","2022","10.1249/mss.0000000000003063","journal article","FALSE",NA
"S530 Nutritional Aspects in Patients With Gastroparesis: Normal BMI Despite Abnormal Intake!","American Journal of Gastroenterology","2022","10.14309/01.ajg.0000858760.29251.49","journal article","TRUE","bronze"
"De Novo ZMYND8 variants result in an autosomal dominant neurodevelopmental disorder with cardiac malformations.","Genetics in medicine : official journal of the American College of Medical Genetics","2022","10.1016/j.gim.2022.06.001","journal article","TRUE","green"
"Two ectopics in a heterotopic pregnancy","Visual Journal of Emergency Medicine","2022","10.1016/j.visj.2022.101474","journal article","FALSE",NA
"ACUTE AND SUSTAINED ALTERATIONS TO THE BONE MARROW IMMUNE MICROENVIRONMENT FOLLOWING POLYMICROBIAL INFECTION.","Shock (Augusta, Ga.)","2022","10.1097/shk.0000000000001951","journal article","FALSE",NA
"An approach for recovering initial temperature via a bounded linear time sampling","Journal of Mathematical Analysis and Applications","2022","10.1016/j.jmaa.2022.126179","journal article","FALSE",NA
"Twin-Neural-Network Differential Autoencoder and Dynamic-Contrast Optical Coherence Tomography for Cancer Diagnostics","Conference on Lasers and Electro-Optics","2022","10.1364/cleo_at.2022.am5i.6","conference proceedings article","FALSE",NA
"Introduction to a Culturally Sensitive Measure of Well-Being: Combining Life Satisfaction and Interdependent Happiness Across 49 Different Cultures","Journal of Happiness Studies","2022","10.1007/s10902-022-00588-1","journal article","TRUE","hybrid"
"Developing a National Trauma Research Action Plan: Results from the Neurotrauma Research Panel Delphi Survey.","The journal of trauma and acute care surgery","2022","10.1097/ta.0000000000003527","journal article","FALSE",NA
"Role of Lysosomal Gene Variants in Modulating GBA-Associated Parkinson's Disease Risk.","Movement disorders : official journal of the Movement Disorder Society","2022","10.1002/mds.28987","journal article","TRUE","green"
"""Worse Than Disappointing"": Prediagnostic Health Care Challenges of Women With Inflammatory Vulvar Dermatoses.","Journal of lower genital tract disease","2022","10.1097/lgt.0000000000000632","journal article","FALSE",NA
"Outcomes after transcarotid artery revascularization stratified by preprocedural symptom status.","Journal of vascular surgery","2022","10.1016/j.jvs.2022.05.024","journal article","TRUE",NA
"CYP2C8, CYP2C9, and CYP2C19 Characterization Using Next-Generation Sequencing and Haplotype Analysis: A GeT-RM Collaborative Project.","The Journal of molecular diagnostics : JMD","2022","10.1016/j.jmoldx.2021.12.011","journal article","TRUE","bronze"
"Cellular assessment of the cornea of transgenic mice models using multi-modal optical coherence microscopy and dual-channel fluorescence microscopy","Multimodal Biomedical Imaging XVII","2022","10.1117/12.2610212","conference proceedings article","FALSE",NA
"IL-1β promotes IL-9-producing Th cell differentiation in IL-2-limiting conditions through the inhibition of BCL6.","Frontiers in immunology","2022","10.3389/fimmu.2022.1032618","journal article","TRUE","gold"
"Bias In, Bias Out: Ethical Considerations for the Application of Machine Learning in Pediatrics.","The Journal of pediatrics","2022","10.1016/j.jpeds.2022.01.035","journal article","FALSE",NA
"Coverage Effects of the ACA's Medicaid Expansion on Adult Reproductive-Aged Women, Postpartum Mothers, and Mothers with Older Children.","Maternal and child health journal","2022","10.1007/s10995-022-03384-8","journal article","TRUE","bronze"
"Effect of pharmacogenomic testing on pediatric mental health outcome: a 6-month follow-up.","Pharmacogenomics","2022","10.2217/pgs-2022-0131","journal article","FALSE",NA
"Reduced Infection Rate After Aseptic Revision Total Knee Arthroplasty With Extended Oral Antibiotic Protocol.","The Journal of arthroplasty","2022","10.1016/j.arth.2022.01.040","journal article","FALSE",NA
"Comparison of Common Outcome Measures for Assessing Independence in Patients Diagnosed with Disorders of Consciousness: A Traumatic Brain Injury Model Systems Study.","Journal of neurotrauma","2022","10.1089/neu.2022.0076","journal article","TRUE","green"
"Dual-technique assay for the analysis of organophosphorus compounds for environmental and chemical defense applications","Green Analytical Chemistry","2022","10.1016/j.greeac.2022.100034","journal article","TRUE","gold"
"Preparing Students for Managing Large-Scale Scientific Data","Proceedings of the ALISE Annual Conference","2022","10.21900/j.alise.2022.988","journal article","TRUE","hybrid"
"The feasibility of using soil seed bank for natural regeneration of degraded sandy grasslands","International Soil and Water Conservation Research","2022","10.1016/j.iswcr.2021.11.001","journal article","TRUE","gold"
"Provider Beliefs, Practices, and Perceived Barriers to Dietary Elimination Therapy in Eosinophilic Esophagitis.","The American journal of gastroenterology","2022","10.14309/ajg.0000000000001988","journal article","TRUE",NA
"Wuzi Yanzong pill attenuates MPTP-induced Parkinson's Disease via PI3K/Akt signaling pathway.","Metabolic brain disease","2022","10.1007/s11011-022-00993-8","journal article","FALSE",NA
"Comparison and Assessment of Prescribing Pattern of Psychotropic Agents in Bipolar Affective Disorder with Mania and Depression","Journal of Drug Delivery and Therapeutics","2022","10.22270/jddt.v12i5-s.5702","journal article","TRUE","gold"
"Optimal equilibrium contracts in the infinite horizon with no commitment across periods","Theory and Decision","2022","10.1007/s11238-022-09894-9","journal article","FALSE",NA
"Early Local Therapy for the Primary Site in De Novo Stage IV Breast Cancer: Results of a Randomized Clinical Trial (EA2108).","Journal of clinical oncology : official journal of the American Society of Clinical Oncology","2022","10.1200/jco.21.02006","journal article","TRUE","green"
"Kidney stone formation in a novel murine model of polycystic kidney disease.","American journal of physiology. Renal physiology","2022","10.1152/ajprenal.00165.2021","journal article","TRUE","green"
"Randomized phase 2 study of ACE-083, a muscle-promoting agent, in facioscapulohumeral muscular dystrophy.","Muscle & nerve","2022","10.1002/mus.27558","journal article","TRUE","hybrid"
"The Effects of Work Demand and Resource Variables on Indian Prison Staff Job Involvement","International Criminology","2022","10.1007/s43576-022-00063-0","journal article","TRUE","bronze"
"Creating a New Set of Milestones for the Clinical Neurophysiology Fellowship.","Journal of clinical neurophysiology : official publication of the American Electroencephalographic Society","2022","10.1097/wnp.0000000000000932","journal article","FALSE",NA
"Do Looks Matter? A Longitudinal Investigation On The Aesthetic Appeal Of Exercise Equipment Location In Predicting Usage And Behavioral Determinants","Medicine & Science in Sports & Exercise","2022","10.1249/01.mss.0000876516.76608.4c","journal article","TRUE","bronze"
"Severe asthma in children: Description of a large multidisciplinary clinical cohort.","Pediatric pulmonology","2022","10.1002/ppul.25887","journal article","TRUE","green"
"Oral Glucose Tolerance Test Measures of First-phase Insulin Response and Their Predictive Ability for Type 1 Diabetes.","The Journal of clinical endocrinology and metabolism","2022","10.1210/clinem/dgac285","journal article","TRUE","bronze"
"The impact of diagnosis and religious orientation on mental illness stigma.","Psychology of Religion and Spirituality","2022","10.1037/rel0000384","journal article","FALSE",NA
"Differentiation between immune checkpoint inhibitor-related and radiation pneumonitis in lung cancer by CT radiomics and machine learning.","Medical physics","2022","10.1002/mp.15451","journal article","TRUE","hybrid"
"P-039: ALTERNATIVE DOSING AND PREVENTION OF TRANSFUSIONS (ADAPT): A PROSPECTIVE TRIAL EVALUATING TRANSFUSION UTILIZATION AND THE FEASIBILITY OF PHARMACOKINETIC HYDROXYUREA DOSING IN CHILDREN WITH SICKLE CELL ANEMIA IN UGANDA","HemaSphere","2022","10.1097/01.hs9.0000873052.78363.19","journal article","TRUE","gold"
"Psychosocial Stress, Epileptic-Like Symptoms and Psychotic Experiences.","Frontiers in psychology","2022","10.3389/fpsyg.2022.804628","journal article","TRUE","gold"
"E-089 Changes in mechanical thrombectomy incidence rate at a comprehensive stroke center before and after Covid-19 shutdown","SNIS 19th annual meeting electronic poster abstracts","2022","10.1136/neurintsurg-2022-snis.200","conference proceedings article","TRUE","bronze"
"Lithium exposure from water (Ovid MEDLINE(R) and Epub Ahead of Print, In-Process, In-Data-Review & Other Non-Indexed Citations, Daily and Versions 1946 to 2021 October 14 and Embase 1974 to 2021 October 17 run simultaneously as a multi-file search in Ovid.).","searchRxiv","2022","10.1079/searchrxiv/20220286417","journal article","TRUE","hybrid"
"The Quick Dementia Rating System and Its Relationship to Biomarkers of Alzheimer's Disease and Neuropsychological Performance.","Dementia and geriatric cognitive disorders","2022","10.1159/000524548","journal article","TRUE","green"
"An in-vitro comparison of four antibacterial agents with and without nicotine and their effects on human gingival fibroblasts.","Journal of periodontology","2022","10.1002/jper.21-0262","journal article","TRUE","green"
"Standard Operating Procedures for Biospecimen Collection, Processing, and Storage: From the Type 1 Diabetes in Acute Pancreatitis Consortium.","Pancreas","2022","10.1097/mpa.0000000000002077","journal article","TRUE","green"
"The designated record set for clinical genetic and genomic testing: A points to consider statement of the American College of Medical Genetics and Genomics (ACMG).","Genetics in medicine : official journal of the American College of Medical Genetics","2022","10.1016/j.gim.2022.11.010","journal article","TRUE","bronze"
"Enhanced Bone Size, Microarchitecture, and Strength in Female Runners with a History of Playing Multidirectional Sports.","Medicine and science in sports and exercise","2022","10.1249/mss.0000000000003016","journal article","TRUE","bronze"
"RNA Deadenylation Subunit CNOT3 Promotes Myeloid Leukemia By Driving Translation of Oncogenic Targets","Blood","2022","10.1182/blood-2022-163026","journal article","TRUE","bronze"
"Regulating Together: Emotion Dysregulation Group Treatment for ASD Youth and Their Caregivers.","Journal of autism and developmental disorders","2022","10.1007/s10803-022-05461-x","journal article","TRUE","bronze"
"Mucoepidermoid Carcinoma of the Salivary Gland: Demographics and Comparative Analysis in U.S. Children and Adults with Future Perspective of Management.","Cancers","2022","10.3390/cancers15010250","journal article","TRUE","gold"
"Physiologic risk factors increase risk of myocardial infarction with transcarotid artery revascularization in prospective trials.","Journal of vascular surgery","2022","10.1016/j.jvs.2022.12.013","journal article","FALSE",NA
"A phase II trial evaluating the efficacy of cabozantinib in the treatment of patients with refractory germ-cell tumors (GCT).","Journal of Clinical Oncology","2022","10.1200/jco.2022.40.6_suppl.tps428","journal article","FALSE",NA
"Presence and Comprehensiveness of Antibullying Policies for Faculty at US Medical Schools.","JAMA network open","2022","10.1001/jamanetworkopen.2022.28673","journal article","TRUE","gold"
"Testing the Job Demands–Job Resources Model for Police Officer Job Burnout in a Sample of Indian Police Officers","International Criminology","2022","10.1007/s43576-022-00046-1","journal article","TRUE","bronze"
"Sexual Concurrency Among Adolescent Women With Multiple Partners: A Daily Diary Study.","The Journal of adolescent health : official publication of the Society for Adolescent Medicine","2022","10.1016/j.jadohealth.2022.02.004","journal article","TRUE","hybrid"
"Communication about cost of cancer care: Attitudes and practices of oncologists.","Journal of Clinical Oncology","2022","10.1200/jco.2022.40.16_suppl.e18826","journal article","FALSE",NA
"S3619 Hiatal Hernia-Induced Non-ST Elevation Myocardial Infarction (NSTEMI): A Unique Complication of Hiatal Hernia","American Journal of Gastroenterology","2022","10.14309/01.ajg.0000871116.76217.b8","journal article","TRUE","bronze"
"Distinctive Temporal Trajectories of Alzheimer's Disease Biomarkers According to Sex and APOE Genotype: Importance of Striatal Amyloid.","Frontiers in aging neuroscience","2022","10.3389/fnagi.2022.829202","journal article","TRUE","gold"
"Clinical, technical, and implementation characteristics of real-world health applications using FHIR.","JAMIA open","2022","10.1093/jamiaopen/ooac077","journal article","TRUE","gold"
"Lack of Cultural and Language Concordant Nutrition Education for Hispanic/Latinx Individuals with CKD: A Call to Action.","Journal of the American Society of Nephrology : JASN","2022","10.1681/asn.2022040430","journal article","TRUE","green"
"Sex-related differences in aging rate are associated with sex chromosome system in amphibians.","Evolution; international journal of organic evolution","2022","10.1111/evo.14410","journal article","TRUE","hybrid"
"Agreement between parent-proxy and child self-report in pediatric hypermobile Ehlers-Danlos syndrome.","Journal of child health care : for professionals working with children in the hospital and community","2022","10.1177/13674935221110081","journal article","FALSE",NA
"Preventing Health Care-Associated Infections Through Implementation of an Interprofessional Visual Management Safety Tracker.","Journal of nursing care quality","2022","10.1097/ncq.0000000000000621","journal article","FALSE",NA
"Robust Bayesian variable selection for gene-environment interactions.","Biometrics","2022","10.1111/biom.13670","journal article","FALSE",NA
"Interaction of stress and alcohol on discriminating fear from safety and reward in male and female rats.","Psychopharmacology","2022","10.1007/s00213-022-06206-5","journal article","TRUE","green"
"Future Needs of the Cybersecurity Workforce","International Conference on Cyber Warfare and Security","2022","10.34190/iccws.17.1.33","journal article","TRUE","hybrid"
"Attrition in entry-level ticket sales positions: a survival analysis","Sport, Business and Management: An International Journal","2022","10.1108/sbm-01-2022-0001","journal article","FALSE",NA
"The seventh international RASopathies symposium: Pathways to a cure-expanding knowledge, enhancing research, and therapeutic discovery.","American journal of medical genetics. Part A","2022","10.1002/ajmg.a.62716","journal article","TRUE","green"
"Online guided meditation training (Isha Kriya) improves self-reported symptoms of anxiety and depression within 2 weeks of practice-An observational study.","Frontiers in psychiatry","2022","10.3389/fpsyt.2022.944973","journal article","TRUE","gold"
"Single-chain insulin analogs threaded by the insulin receptor αCT domain.","Biophysical journal","2022","10.1016/j.bpj.2022.09.038","journal article","TRUE","hybrid"
"Evaluation of the Three National Lesbian, Gay, Bisexual, Transgender, Queer, and Other Sexual and Gender Minority (LGBTQ+)-Competent Provider Directories in the United States.","Journal of homosexuality","2022","10.1080/00918369.2022.2040930","journal article","FALSE",NA
"Limited English Proficiency and Video or Telephone Interpreters (MEDLINE).","searchRxiv","2022","10.1079/searchrxiv.2022.00036","journal article","FALSE",NA
"Preoperative Visual Measures of Verbal Learning and Memory and their Relations to Speech Recognition After Cochlear Implantation.","Ear and hearing","2022","10.1097/aud.0000000000001155","journal article","TRUE","green"
"Helping the Helpers - A research protocol for user-centered technology to aid caregiver management of medications for people with Alzheimer's disease and related dementias.","Research in social & administrative pharmacy : RSAP","2022","10.1016/j.sapharm.2022.03.014","journal article","TRUE","hybrid"
"An interdisciplinary perspective on private sector engagement in cross‐sector partnerships: The <scp><i>why</i></scp>, <scp><i>where</i></scp>, and <scp><i>how</i></scp>","Business and Society Review","2022","10.1111/basr.12283","journal article","TRUE","hybrid"
"Remote ischemic conditioning in Ossabaw minipigs induces the release of humoral cardioprotective triggers, but the myocardium does not respond with reduced infarct size.","American journal of physiology. Heart and circulatory physiology","2022","10.1152/ajpheart.00580.2022","journal article","TRUE",NA
"Genetic variants in the SHISA6 gene are associated with delayed cognitive impairment in two family datasets.","Alzheimer's & dementia : the journal of the Alzheimer's Association","2022","10.1002/alz.12686","journal article","TRUE","green"
"492TiP A phase I study of synthetic lethal, IDE397 (MAT2A inhibitor) as a monotherapy and in combination with chemotherapy in advanced solid tumors harboring MTAP deletion","Annals of Oncology","2022","10.1016/j.annonc.2022.07.620","journal article","TRUE","hybrid"
"Combating CHK1 resistance in triple negative breast cancer: EGFR inhibition as potential combinational therapy.","Cancer drug resistance (Alhambra, Calif.)","2022","10.20517/cdr.2021.128","journal article","TRUE","gold"
"Antigen Trafficking and Possibly Intrinsic Immunostimulatory Properties Shape High Immunogenicity of Factor VIII","Blood","2022","10.1182/blood-2022-163879","journal article","TRUE","bronze"
"Building Inpatient Pediatric Readiness for the Clinically Deteriorating Child.","Hospital pediatrics","2022","10.1542/hpeds.2021-006230","journal article","FALSE",NA
"Hyperechoic Renal Masses: Differentiation of Angiomyolipomas from Renal Cell Carcinomas using Tumor Size and Ultrasound Radiomics.","Ultrasound in medicine & biology","2022","10.1016/j.ultrasmedbio.2022.01.011","journal article","FALSE",NA
"Isolated Third Nerve Palsy as the Initial Manifestation of a Large Clival Chordoma.","Journal of neuro-ophthalmology : the official journal of the North American Neuro-Ophthalmology Society","2022","10.1097/wno.0000000000001764","journal article","FALSE",NA
"Role of daratumumab in relapsed or refractory multiple myeloma patient: A meta-analysis and literature to review.","Journal of family medicine and primary care","2022","10.4103/jfmpc.jfmpc_1987_21","journal article","TRUE","gold"
"Plasma biomarkers predict amyloid pathology in cognitively normal monozygotic twins after 10 years.","Brain communications","2022","10.1093/braincomms/fcad024","journal article","TRUE","gold"
"1340. Yield of Repeat Blood Cultures beyond 48 Hours after Negative Initial Cultures in Patients Hospitalized on a Pediatric Hematology/Oncology Unit","Open Forum Infectious Diseases","2022","10.1093/ofid/ofac492.1169","journal article","TRUE","gold"
"A two-phase approach to re-calibrating expensive computer simulation for sex-specific colorectal neoplasia development modeling.","BMC medical informatics and decision making","2022","10.1186/s12911-022-01991-7","journal article","TRUE","gold"
"Application of the Latest Advances in Evidence-Based Medicine in Primary Biliary Cholangitis.","The American journal of gastroenterology","2022","10.14309/ajg.0000000000002070","journal article","TRUE","hybrid"
