"Title","Journal.Name","Pub.Year","DOI","OA.Flag"
"association between the first-hour intravenous fluid volume and mortality in pediatric septic shock.","Annals of emergency medicine",2022,"10.1016/j.annemergmed.2022.04.008",FALSE
"topical pharyngeal anesthesia and upper endoscopy (embase).","searchRxiv",2022,"10.1079/searchrxiv.2022.00044",TRUE
"all trans-retinoic acid modulates hyperoxia-induced suppression of nf-kb-dependent wnt signaling in alveolar a549 epithelial cells.","PloS one",2022,"10.1371/journal.pone.0272769",TRUE
"erythropoietic effects of vadadustat in patients with anemia associated with chronic kidney disease.","American journal of hematology",2022,"10.1002/ajh.26644",TRUE
"360-degree approaches to the craniocervical junction: a technical and anatomical overview of the far lateral, anterolateral, and endoscopic endonasal far medial approach","31st Annual Meeting North American Skull Base Society",2022,"10.1055/s-0042-1743984",FALSE
"intrinsic adaptations in oxphos power output and reduced tumorigenicity characterize doxorubicin resistant ovarian cancer cells.","Biochimica et biophysica acta. Bioenergetics",2022,"10.1016/j.bbabio.2022.148915",TRUE
"making the rounds: exploring the role of circulating tumor dna (ctdna) in non-small cell lung cancer.","International journal of molecular sciences",2022,"10.3390/ijms23169006",TRUE
"long-term survival after surgery versus ablation for early liver cancer in a large, nationally representative cohort.","Journal of the American College of Radiology : JACR",2022,"10.1016/j.jacr.2022.07.010",FALSE
"peripheral neuropathy in children with high risk hodgkin lymphoma (hl): the role of protocol-stipulated dose modification in the children's oncology group (cog) ahod1331 study","Blood",2022,"10.1182/blood-2022-167046",TRUE
"generation of the organotypic kidney structure by integrating pluripotent stem cell-derived renal stroma.","Nature communications",2022,"10.1038/s41467-022-28226-7",TRUE
"analgesia, sedation, paralytics, delirium, and iatrogenic withdrawal.","Pediatric clinics of North America",2022,"10.1016/j.pcl.2022.01.012",FALSE
"hospital opioid usage and adverse events in patients with end-stage liver disease.","Journal of pain and symptom management",2022,"10.1016/j.jpainsymman.2022.11.026",FALSE
"utilizing novel tbi-on-a-chip device to link physical impacts to neurodegeneration and decipher primary and secondary injury mechanisms.","Scientific reports",2022,"10.1038/s41598-022-14937-w",TRUE
"artificial intelligence to aid glaucoma diagnosis and monitoring: state of the art and new directions.","Photonics",2022,"10.3390/photonics9110810",TRUE
"use of preventive cardiovascular health care among asian american individuals: a national health interview survey study.","Current problems in cardiology",2022,"10.1016/j.cpcardiol.2022.101241",FALSE
"young adult pain rehabilitation: interdisciplinary development and preliminary outcomes of a novel treatment program.","Pain medicine (Malden, Mass.)",2022,"10.1093/pm/pnac172",FALSE
"natural history and consequence of patent processus vaginalis: an interim analysis from a multi-institutional prospective observational study.","Journal of pediatric surgery",2022,"10.1016/j.jpedsurg.2022.09.012",FALSE
"counterintuitive production of tumor-suppressive secretomes from oct4- and c-myc-overexpressing tumor cells and mscs.","Theranostics",2022,"10.7150/thno.70549",TRUE
"corrigendum to ""a novel survivin dimerization inhibitor without a labile hydrazone linker induces spontaneous apoptosis and synergizes with docetaxel in prostate cancer cells"" [bioorg. med. chem. 65 (2022) 116761].","Bioorganic & medicinal chemistry",2022,"10.1016/j.bmc.2022.117127",TRUE
"patient-reported outcomes in hcc: a scoping review by the practice metrics committee of the american association for the study of liver diseases.","Hepatology (Baltimore, Md.)",2022,"10.1002/hep.32313",TRUE
"multi-institutional intervention to improve patient perception of physician empathy in emergency care.","Emergency medicine journal : EMJ",2021,"10.1136/emermed-2020-210757",FALSE
"variables associated with concordance or discordance for delirium diagnosis between referring and consulting physicians at a tertiary hospital in colombia: prospective observational study.","Medicine",2022,"10.1097/md.0000000000032096",TRUE
"pan-cancer (ca) analysis of the safety and efficacy of immune checkpoint inhibitors (ici) in patients (pts) living with hiv (plwh): results from the international catch-it consortium.","Journal of Clinical Oncology",2022,"10.1200/jco.2022.40.16_suppl.2649",FALSE
"parental perceptions and the 5c psychological antecedents of covid-19 vaccination during the first month of omicron variant surge: a large-scale cross-sectional survey in saudi arabia.","Frontiers in pediatrics",2022,"10.3389/fped.2022.944165",TRUE
"medical student perspectives on the ethics of pelvic exams under anesthesia: a multi-institutional study✰.","Journal of surgical education",2022,"10.1016/j.jsurg.2022.05.015",FALSE
"management of hypertension in advanced kidney disease.","Current opinion in nephrology and hypertension",2022,"10.1097/mnh.0000000000000812",TRUE
"long-term quality of integrated community case management care for children in bugoye subcounty, uganda: a retrospective observational study.","BMJ open",2022,"10.1136/bmjopen-2021-051015",TRUE
"commensalism: we can live without it, but who would want to?","Academic radiology",2021,"10.1016/j.acra.2021.11.007",FALSE
"classical and nonclassical manifestations of primary hyperparathyroidism.","Journal of bone and mineral research : the official journal of the American Society for Bone and Mineral Research",2022,"10.1002/jbmr.4679",TRUE
"consensus recommendations for eosinophilic gastrointestinal disease nomenclature.","Journal of pediatric gastroenterology and nutrition",2022,"10.1097/mpg.0000000000003454",FALSE
"lipoblastoma-like tumor of the vulva: a rare benign mesenchymal neoplasm mimicking myxoid liposarcoma","American Journal of Clinical Pathology",2022,"10.1093/ajcp/aqac126.064",TRUE
"complementary and alternative medicine and irritable bowel syndrome (psycinfo).","searchRxiv",2022,"10.1079/searchrxiv.2022.00023",TRUE
"herpes simplex virus and rates of cognitive decline or whole brain atrophy in the dominantly inherited alzheimer network.","Annals of clinical and translational neurology",2022,"10.1002/acn3.51669",TRUE
"a novel survivin dimerization inhibitor without a labile hydrazone linker induces spontaneous apoptosis and synergizes with docetaxel in prostate cancer cells.","Bioorganic & medicinal chemistry",2022,"10.1016/j.bmc.2022.116761",TRUE
"pancreas transplantation: current challenges, considerations, and controversies.","The Journal of clinical endocrinology and metabolism",2022,"10.1210/clinem/dgac644",FALSE
"transitions between alternating childhood allergy sensitization-asthma states - a retrospective cohort analysis","B26. BREATHE IN, BREATHE OUT: INSIGHTS INTO PEDIATRIC ASTHMA",2022,"10.1164/ajrccm-conference.2022.205.1_meetingabstracts.a2504",FALSE
"mutational and splicing landscape in a cohort of 43,000 patients tested for hereditary cancer.","NPJ genomic medicine",2022,"10.1038/s41525-022-00323-y",TRUE
"the human monkeypox in saudi arabia and global tourism.","Annals of medicine and surgery (2012)",2022,"10.1016/j.amsu.2022.104686",TRUE
"effects of obesity and acute resistance exercise on skeletal muscle angiogenic communication pathways.","Experimental physiology",2022,"10.1113/ep090152",FALSE
"a study of pembrolizumab (pembro) in combination with y90 radioembolization in patients (pts) with poor prognosis hepatocellular carcinoma (hcc) with preserved liver function.","Journal of Clinical Oncology",2022,"10.1200/jco.2022.40.4_suppl.422",FALSE
"kin17 promotes cell migration and invasion through stimulating the tgf-β/smad2 pathway in hepatocellular carcinoma.","Molecular carcinogenesis",2022,"10.1002/mc.23492",FALSE
"gene therapy - are we ready now?","Haemophilia : the official journal of the World Federation of Hemophilia",2022,"10.1111/hae.14530",TRUE
"adenoid cystic carcinoma (acc) infiltrating the skull base: a systematic review of clinical characteristics and management strategies.","Cancer diagnosis & prognosis",2022,"10.21873/cdp.10134",TRUE
"outcomes of pediatric patients with sepsis managed on extracorporeal membrane oxygenation: an analysis of the extracorporeal life support organization registry","Journal of Pediatric Intensive Care",2022,"10.1055/s-0042-1758480",FALSE
"23rd annual feigenbaum lecture: history of echocardiography: a personal perspective.","Journal of the American Society of Echocardiography : official publication of the American Society of Echocardiography",2022,"10.1016/j.echo.2022.09.015",FALSE
"pharmacokinetics of budesonide oral suspension in children and adolescents with eosinophilic esophagitis.","Journal of pediatric gastroenterology and nutrition",2022,"10.1097/mpg.0000000000003482",TRUE
"implementation of multimodal pain protocol associated with opioid use reduction in trauma patients.","The Journal of surgical research",2022,"10.1016/j.jss.2022.10.052",FALSE
"early-life low-level lead exposure alters anxiety-like behavior, voluntary alcohol consumption and ac5 protein content in adult male and female c57bl/6 j mice.","Neurotoxicology and teratology",2022,"10.1016/j.ntt.2022.107149",FALSE
"paediatric mandibular distraction: optimizing outcomes.","Current opinion in otolaryngology & head and neck surgery",2022,"10.1097/moo.0000000000000851",FALSE
"healthcare workers' sars-cov-2 omicron variant uncertainty-related stress, resilience, and coping strategies during the first week of the world health organization's alert.","International journal of environmental research and public health",2022,"10.3390/ijerph19041944",TRUE
"significance of granulomas in the outcomes of crohn's disease patients.","Annals of gastroenterology",2022,"10.20524/aog.2022.0730",TRUE
"association between symptom burden at initiation of a graduated return to activity protocol and time to return to unrestricted activity after concussion in service academy cadets.","The American journal of sports medicine",2022,"10.1177/03635465211067551",FALSE
"comparative responsiveness and minimally important difference of fatigue symptom inventory (fsi) scales and the fsi-3 in trials with cancer survivors.","Journal of patient-reported outcomes",2022,"10.1186/s41687-022-00488-1",TRUE
"workforce characteristics of med-peds hospitalists.","Cureus",2022,"10.7759/cureus.24799",TRUE
"warfarin versus factor xa inhibitors in the long-term treatment of cerebral venous sinus thrombosis a single-center retrospective analysis.","eNeurologicalSci",2022,"10.1016/j.ensci.2022.100412",TRUE
"the nature of harm: a wine-dark sea.","The American journal of bioethics : AJOB",2022,"10.1080/15265161.2022.2110981",FALSE
"current and future physiologically based pharmacokinetic (pbpk) modeling approaches to optimize pharmacotherapy in preterm neonates.","Expert opinion on drug metabolism & toxicology",2022,"10.1080/17425255.2022.2099836",TRUE
"contemporary trends in pgd incidence, outcomes, and therapies.","The Journal of heart and lung transplantation : the official publication of the International Society for Heart Transplantation",2022,"10.1016/j.healun.2022.08.013",TRUE
"pharmacological properties of jaeumgeonbi-tang on redox system and stress-related hormones in chronic subjective dizziness: a randomized, double-blind, parallel-group, placebo-controlled trial.","Pharmaceuticals (Basel, Switzerland)",2022,"10.3390/ph15111375",TRUE
"glaucoma treatment outcomes in open angle glaucoma patients of african descent.","Journal of glaucoma",2022,"10.1097/ijg.0000000000002027",TRUE
"comparative assessment of biomechanical parameters in subjects with multiple cerebral aneurysms using fluid-structure interaction simulations.","Journal of biomechanical engineering",2022,"10.1115/1.4056317",TRUE
"relative hypercoagulopathy of the sars-cov-2 beta and delta variants when compared to the less severe omicron variants is related to teg parameters, the extent of fibrin amyloid microclots, and the severity of clinical illness.","Seminars in thrombosis and hemostasis",2022,"10.1055/s-0042-1756306",TRUE
"shea statement on antibiotic stewardship in hospitals during public health emergencies.","Infection control and hospital epidemiology",2022,"10.1017/ice.2022.194",TRUE
"determinants of lung function across childhood in the severe asthma research program (sarp) 3.","The Journal of allergy and clinical immunology",2022,"10.1016/j.jaci.2022.08.014",TRUE
"coinfection with chlamydial and gonorrheal infection among us adults with early syphilis.","Sexually transmitted diseases",2022,"10.1097/olq.0000000000001605",TRUE
"ctni-01. effect of pre-operative stereotactic radiosurgery on brain metastasis: analysis of dna and rna genomic profiles from phase-ii clinical trial nct03398694","Neuro-Oncology",2022,"10.1093/neuonc/noac209.268",TRUE
"monkeypox disease (mpox) perceptions among healthcare workers versus general population during the first month of the who alert: cross-sectional survey in saudi arabia.","Vaccines",2022,"10.3390/vaccines10122071",TRUE
"effect of oral methylprednisolone on decline in kidney function or kidney failure in patients with iga nephropathy: the testing randomized clinical trial.","JAMA",2022,"10.1001/jama.2022.5368",TRUE
"whole body ct for trauma reduces emergency department time for patients with lower extremity fractures.","Emergency radiology",2022,"10.1007/s10140-022-02030-8",FALSE
"0518 clinical correlates, diagnosis, and management of sleep-disordered breathing in young children with down syndrome","Sleep",2022,"10.1093/sleep/zsac079.515",TRUE
"diminished immune surveillance during histologic progression of intraductal papillary mucinous neoplasms offers a therapeutic opportunity for cancer interception.","Clinical cancer research : an official journal of the American Association for Cancer Research",2022,"10.1158/1078-0432.ccr-21-2585",TRUE
"the importance of an exam post-mortem: step 2 cs.","Academic radiology",2022,"10.1016/j.acra.2021.12.004",FALSE
"antithrombotic strategy after transcatheter aortic valve replacement: a network meta-analysis.","Current problems in cardiology",2022,"10.1016/j.cpcardiol.2022.101348",FALSE
"a novel murine model of combined insulin-dependent diabetes and chronic kidney disease has greater skeletal detriments than either disease individually.","Bone",2022,"10.1016/j.bone.2022.116559",TRUE
"impact of diet on hydrogen sulfide production: implications for gut health.","Current opinion in clinical nutrition and metabolic care",2022,"10.1097/mco.0000000000000881",TRUE
"respiratory distress syndrome management in resource limited settings-current evidence and opportunities in 2022.","Frontiers in pediatrics",2022,"10.3389/fped.2022.961509",TRUE
"integrin α5 is regulated by mir-218-5p in endothelial progenitor cells.","Journal of the American Society of Nephrology : JASN",2022,"10.1681/asn.2021020140",TRUE
"craniopharyngiomas invading the ventricular system: a systematic review.","Anticancer research",2022,"10.21873/anticanres.15919",TRUE
"penguin: a tool for predicting pseudouridine sites in direct rna nanopore sequencing data.","Methods (San Diego, Calif.)",2022,"10.1016/j.ymeth.2022.02.005",TRUE
"exploring the ripples of the 2018 organ allocation policy change.","Journal of cardiac surgery",2022,"10.1111/jocs.16433",FALSE
"414: disseminated ureaplasma urealyticum infection and life-threatening hyperammonemia with rituximab use","Critical Care Medicine",2022,"10.1097/01.ccm.0000907384.65908.a7",TRUE
"real-time computer aided detection of solid focal pancreatic masses in endoscopic ultrasound imaging based on convolutional neural networks","ESGE Days 2022",2022,"10.1055/s-0042-1745268",FALSE
"l-cysteine methyl ester overcomes the deleterious effects of morphine on ventilatory parameters and arterial blood-gas chemistry in unanesthetized rats.","Frontiers in pharmacology",2022,"10.3389/fphar.2022.968378",TRUE
"contrasting arguments for women in medicine: a historical overview for radiologists.","Journal of the American College of Radiology : JACR",2022,"10.1016/j.jacr.2022.08.016",FALSE
"delusions and hallucinations are associated with greater severity of delirium.","Journal of the Academy of Consultation-Liaison Psychiatry",2022,"10.1016/j.jaclp.2022.12.007",FALSE
"synthesis and biological evaluation of cardiac glycosides for cancer therapy by targeting the dna damage response.","ChemMedChem",2022,"10.1002/cmdc.202200415",TRUE
"donor simvastatin treatment is safe and might improve outcomes after liver transplantation: a randomized clinical trial.","Transplantation",2022,"10.1097/tp.0000000000004220",TRUE
"a national survey of u.s. adolescent sleep duration, timing, and social jetlag during the covid-19 pandemic.","Behavioral sleep medicine",2022,"10.1080/15402002.2022.2086871",FALSE
"rethinking the tools in the toolbox.","Journal of neuroengineering and rehabilitation",2022,"10.1186/s12984-022-01041-3",TRUE
"growth parameters in children with achondroplasia: a 7-year, prospective, multinational, observational study.","Genetics in medicine : official journal of the American College of Medical Genetics",2022,"10.1016/j.gim.2022.08.015",FALSE
"efficacy of a proprietary fenugreek seed extract (trigonella foenum-graecum, furocyst®) in women with polycystic ovary syndrome (pcos): a randomized, double-blind, placebo-controlled study.","Journal of the American Nutrition Association",2022,"10.1080/27697061.2022.2126410",FALSE
"hereditary alpha-tryptasemia modifies clinical phenotypes among individuals with congenital hypermobility disorders.","HGG advances",2022,"10.1016/j.xhgg.2022.100094",TRUE
"incidence of severe covid-19 illness following vaccination and booster with bnt162b2, mrna-1273, and ad26.cov2.s vaccines.","JAMA",2022,"10.1001/jama.2022.17985",TRUE
"a flexible near-field biosensor for multisite arterial blood flow detection.","Sensors (Basel, Switzerland)",2022,"10.3390/s22218389",TRUE
"shell disorder models detect that omicron has harder shells with attenuation but is not a descendant of the wuhan-hu-1 sars-cov-2.","Biomolecules",2022,"10.3390/biom12050631",TRUE
"test-retest reliability and efficacy of individual symptoms in concussion management.","Clinical journal of sport medicine : official journal of the Canadian Academy of Sport Medicine",2022,"10.1097/jsm.0000000000001084",FALSE
"journal of pediatric gastroenterology and nutrition-the highlights of 2021.","Journal of pediatric gastroenterology and nutrition",2022,"10.1097/mpg.0000000000003480",FALSE
"point-of-care echocardiography of the right heart improves acute heart failure risk stratification for low-risk patients: the reed-ahf prospective study.","Academic emergency medicine : official journal of the Society for Academic Emergency Medicine",2022,"10.1111/acem.14589",TRUE
"interobserver agreement for ct and mri findings of chronic pancreatitis in children: a multicenter ancillary study under the insppire consortium.","AJR. American journal of roentgenology",2022,"10.2214/ajr.21.27234",TRUE
"adverse events associated with egd and egd-related techniques.","Gastrointestinal endoscopy",2022,"10.1016/j.gie.2022.04.024",FALSE
"1148: multidisciplinary team members' psychological and task load burden during resuscitation events","Critical Care Medicine",2022,"10.1097/01.ccm.0000910328.52030.f1",TRUE
"212: obstructive shock due to acute thrombosis of bioprosthetic mitral valve: pocus for a rare diagnosis","Critical Care Medicine",2022,"10.1097/01.ccm.0000906584.89408.7d",TRUE
"association between prescribed opioid dose and risk of motor vehicle crashes.","Pain",2022,"10.1097/j.pain.0000000000002790",FALSE
"the vaping epidemic in latinx adolescents","B19. UNCOVERING HEALTH DISPARITIES IN PEDIATRIC LUNG DISEASE",2022,"10.1164/ajrccm-conference.2022.205.1_meetingabstracts.a2395",FALSE
"injury patterns and associated demographics of intimate partner violence in men presenting to u.s. emergency departments.","Aggressive behavior",2021,"10.1002/ab.22007",TRUE
"canonical wnt/β-catenin signaling has positive effects on osteogenesis, but can have negative effects on cementogenesis.","Journal of periodontology",2022,"10.1002/jper.21-0599",FALSE
"association of multiplex-immunofluorescence (m-if) and gene expression signature with prognosis and bevacizumab (bev) treatment outcomes in nrg oncology/nsabp c-08: implications for combining immune checkpoint blockade (icb) and bev.","Journal of Clinical Oncology",2022,"10.1200/jco.2022.40.4_suppl.140",FALSE
"assessing the pathophysiology of hyperglycemia in the diabetes related to acute pancreatitis and its mechanisms study: from the type 1 diabetes in acute pancreatitis consortium.","Pancreas",2022,"10.1097/mpa.0000000000002074",TRUE
"functional status of heart transplant recipients predicts survival.","Clinical transplantation",2022,"10.1111/ctr.14748",FALSE
"baby blues: a rare case of transient pulmonary arteriovenous malformation during pregnancy","A38. CASE REPORTS: PUZZLES IN PULMONARY DISEASE",2022,"10.1164/ajrccm-conference.2022.205.1_meetingabstracts.a1435",FALSE
"controversial covid-19 cures: hydroxychloroquine and oleander pediatric ingestion simulation cases.","Cureus",2022,"10.7759/cureus.26176",TRUE
"symptom-based covid-19 prognosis through ai-based iot: a bioinformatics approach.","BioMed research international",2022,"10.1155/2022/3113119",TRUE
"myeloid cell-specific mutation of spi1 selectively reduces m2-biased macrophage numbers in skeletal muscle, reduces age-related muscle fibrosis and prevents sarcopenia.","Aging cell",2022,"10.1111/acel.13690",TRUE
"morphologic changes in the thymus following chemotherapy for anterior mediastinal germ cell tumors: a study of 91 cases emphasizing pseudoneoplastic features.","Archives of pathology & laboratory medicine",2022,"10.5858/arpa.2021-0631-oa",TRUE
"salvage high-dose chemotherapy (hdct) for relapsed primary mediastinal nonseminomatous germ-cell tumors (pmnsgct).","Journal of Clinical Oncology",2022,"10.1200/jco.2022.40.16_suppl.5032",FALSE
"tumors involving the infratemporal fossa: a systematic review of clinical characteristics and treatment outcomes.","Cancers",2022,"10.3390/cancers14215420",TRUE
"patient-reported outcomes following sectioning of the filum terminale for treatment of tethered cord syndrome associated with ehlers-danlos syndrome.","Cureus",2022,"10.7759/cureus.24679",TRUE
"metastases in the pineal region: a systematic review of clinical features, management strategies, and survival outcomes.","World neurosurgery",2022,"10.1016/j.wneu.2022.01.005",TRUE
"the foundation and the four pillars of treatment for cardiorenal protection in people with chronic kidney disease and type 2 diabetes.","Nephrology, dialysis, transplantation : official publication of the European Dialysis and Transplant Association - European Renal Association",2022,"10.1093/ndt/gfac331",TRUE
"composition and functional potential of the human mammary microbiota prior to and following breast tumor diagnosis.","mSystems",2022,"10.1128/msystems.01489-21",TRUE
"attitudes of healthcare workers in low-resource settings to mobile virtual reality simulations for newborn resuscitation training – a report from the ehbb/mhbs study","Pediatrics",2021,"10.1542/peds.147.3ma3.229",FALSE
"pedicle screw-associated violation of the adjacent unfused facet joint: clinical outcomes and fusion rates.","Global spine journal",2022,"10.1177/21925682221145651",TRUE
"complications and outcomes of posterior fossa decompression with duraplasty versus without duraplasty for pediatric patients with chiari malformation type i and syringomyelia: a study from the park-reeves syringomyelia research consortium.","Journal of neurosurgery. Pediatrics",2022,"10.3171/2022.2.peds21446",TRUE
"the enl yeats epigenetic reader domain critically links mll-enl to leukemic stem cell frequency in t(11;19) leukemia.","Leukemia",2022,"10.1038/s41375-022-01765-0",FALSE
"factors affecting adherence to intranasal treatment for allergic rhinitis: a qualitative study.","Laryngoscope investigative otolaryngology",2022,"10.1002/lio2.986",TRUE
"bridging to adulthood -- pediatric to adult transition experience of young adults with neuromuscular disease and ventilator-dependent chronic respiratory failure","C22. INFLUENCE OF SYSTEMS AND SOCIETY ON HEALTHCARE AND HEALTHCARE DELIVERY",2022,"10.1164/ajrccm-conference.2022.205.1_meetingabstracts.a3783",FALSE
"proton pump inhibitor use and obesity-associated cancer in the women's health initiative.","Nutrition and cancer",2022,"10.1080/01635581.2022.2108467",TRUE
"multimodal magnetic resonance imaging reveals distinct sensitivity of hippocampal subfields in asymptomatic stage of alzheimer's disease.","Frontiers in aging neuroscience",2022,"10.3389/fnagi.2022.901140",TRUE
"a case of pulmonary anthracofibrosis","TP34. TP034 INTERESTING DIFFUSE PARENCHYMAL LUNG DISEASE CASES",2021,"10.1164/ajrccm-conference.2021.203.1_meetingabstracts.a2073",TRUE
"elevated c-reactive protein and subsequent patient-reported cognitive problems in older breast cancer survivors: the thinking and living with cancer study.","Journal of clinical oncology : official journal of the American Society of Clinical Oncology",2022,"10.1200/jco.22.00406",FALSE
"the evolution of device-assisted enteroscopy: from sonde enteroscopy to motorized spiral enteroscopy.","Frontiers in medicine",2021,"10.3389/fmed.2021.792668",TRUE
"assessment of dynamic corneal nerve changes using static landmarks by in vivo large-area confocal microscopy-a longitudinal proof-of-concept study.","Quantitative imaging in medicine and surgery",2022,"10.21037/qims-22-15",TRUE
