"Title","Journal.Name","Pub.Year","DOI","OA.Flag"
"relational coordination among military and civilian nurses and physicians in an army hospital: do demographic characteristics and professional roles matter?","The Journal of nursing administration",2022,"10.1097/nna.0000000000001150",TRUE
"precision medicine in type 1 diabetes.","Diabetologia",2022,"10.1007/s00125-022-05778-3",TRUE
"comparison of nonprofit hospital community benefit substance abuse identification and practice implementation in appalachian and non-appalachian counties.","Journal of public health management and practice : JPHMP",2022,"10.1097/phh.0000000000001646",FALSE
"re: scott wilkinson, huihui ye, fatima karzai, et al. nascent prostate cancer heterogeneity drives evolution and resistance to intense hormonal therapy. eur urol. in press. https://doi.org/10.1016/j.eururo.2021.03.009: focus on intraductal carcinoma of the prostate.","European urology",2021,"10.1016/j.eururo.2021.06.001",FALSE
"transforaminal lumbar interbody fusion with a silicon nitride cage demonstrates early radiographic fusion.","Journal of spine surgery (Hong Kong)",2022,"10.21037/jss-21-115",TRUE
"valley position for a primary ciliary dyskinesia (kartagener's syndrome) parturient to optimize respiratory function during cesarean delivery.","International journal of obstetric anesthesia",2022,"10.1016/j.ijoa.2022.103619",FALSE
"the 5th edition of the world health organization classification of haematolymphoid tumours: myeloid and histiocytic/dendritic neoplasms.","Leukemia",2022,"10.1038/s41375-022-01613-1",TRUE
"implication of the emergence of the delta (b.1.617.2) variants on vaccine effectiveness.","Infection",2022,"10.1007/s15010-022-01759-1",TRUE
"distal and proximal predictors of rehospitalization over 10 years among survivors of tbi: a national institute on disability, independent living, and rehabilitation research traumatic brain injury model systems study.","The Journal of head trauma rehabilitation",2022,"10.1097/htr.0000000000000812",TRUE
"validation of and demographically adjusted normative data for the learning ratio derived from the ravlt in robustly intact older adults.","Archives of clinical neuropsychology : the official journal of the National Academy of Neuropsychologists",2022,"10.1093/arclin/acac002",TRUE
"implementing brief tobacco cessation interventions in community pharmacies: an application of rogers' diffusion of innovations theory.","Pharmacy (Basel, Switzerland)",2022,"10.3390/pharmacy10030056",TRUE
"sustained release of tacrolimus from a topical drug delivery system promotes corneal reinnervation.","Translational vision science & technology",2022,"10.1167/tvst.11.8.20",TRUE
"sensitivity and specificity of the impact neurocognitive test in collegiate athletes and us military service academy cadets with adhd and/or ld: findings from the ncaa-dod care consortium.","Sports medicine (Auckland, N.Z.)",2022,"10.1007/s40279-022-01768-y",FALSE
"disease progression pathways of wet amd: opportunities for new target discovery.","Expert opinion on therapeutic targets",2022,"10.1080/14728222.2022.2030706",TRUE
"examining allostatic load, neighborhood socioeconomic status, symptom burden and mortality in multiple myeloma patients.","Blood cancer journal",2022,"10.1038/s41408-022-00648-y",TRUE
"metabolic biomarkers of mediterranean diet in pregnant women","Current Developments in Nutrition",2021,"10.1093/cdn/nzab038_011",TRUE
"hospital transfers: perspectives of nursing home residents and nurses","Innovation in Aging",2022,"10.1093/geroni/igac059.2579",TRUE
"pragmatic trials in long-term care: research challenges and potential solutions in relation to key areas of care.","Journal of the American Medical Directors Association",2022,"10.1016/j.jamda.2021.12.011",TRUE
"osteoarthritic severity in unresurfaced patellae does not adversely affect patient-reported outcomes in contemporary primary tka.","Journal of the American Academy of Orthopaedic Surgeons. Global research & reviews",2022,"10.5435/jaaosglobal-d-22-00041",TRUE
"east mct: comparison of pre-injury antithrombotic use and reversal strategies among severe tbi patients.","The journal of trauma and acute care surgery",2021,"10.1097/ta.0000000000003421",FALSE
"starting a medical 3d printing lab for otolaryngology-head and neck surgery collaboration.","American journal of otolaryngology",2021,"10.1016/j.amjoto.2021.103322",FALSE
"role of non-coding rnas on liver metabolism and nafld pathogenesis.","Human molecular genetics",2022,"10.1093/hmg/ddac088",FALSE
"urinary excretion of low-osmolar contrast media during small-bowel follow-through studies in infants is not definitive evidence of bowel perforation.","Pediatric radiology",2022,"10.1007/s00247-022-05463-y",FALSE
"comparison of c<sub>2</sub>n diagnostics' aβ40, 42, and 42/40 ratio in plasma stored in micronic and sarstedt tubes","Alzheimer's & Dementia",2022,"10.1002/alz.068067",FALSE
"tlr2/4-mediated hyperinflammation promotes cherubism-like jawbone expansion in sh3bp2 (p416r) knockin mice.","JBMR plus",2021,"10.1002/jbm4.10562",TRUE
"author correction: the human connectome in alzheimer disease - relationship to biomarkers and genetics","Nature reviews. Neurology",2021,"10.1038/s41582-021-00554-0",TRUE
"interplay of the human exposome, metabolome and gut microbiome in dementia and major depression","Alzheimer's & Dementia",2022,"10.1002/alz.067261",TRUE
"the effect of age on longitudinal measures of beta cell function and insulin sensitivity during the progression of early stage type 1 diabetes.","Diabetologia",2022,"10.1007/s00125-022-05836-w",TRUE
"testosterone deficiency and the aging male.","International journal of impotence research",2022,"10.1038/s41443-022-00555-7",FALSE
"assaults in schools: findings using a national data base.","Journal of forensic and legal medicine",2022,"10.1016/j.jflm.2022.102306",FALSE
"collecting biospecimens and obtaining biobank consent from patients in an academic health care setting: practical and ethical considerations.","Academic medicine : journal of the Association of American Medical Colleges",2021,"10.1097/acm.0000000000004418",TRUE
"identification of colorectal cancer using structured and free text clinical data.","Health informatics journal",2022,"10.1177/14604582221134406",TRUE
"role of neurochemistry in amyloid pathology using 5xfad transgenic mouse model of ad: a single‐voxel magnetic resonance spectroscopy (mrs) study","Alzheimer's & Dementia",2022,"10.1002/alz.065794",FALSE
"differential vulnerability of hippocampal microstructure in 5xfad mouse model of alzheimer's disease: a dmri study","Alzheimer's & Dementia",2022,"10.1002/alz.066288",TRUE
"a framework for detecting noncoding rare-variant associations of large-scale whole-genome sequencing studies.","Nature methods",2022,"10.1038/s41592-022-01640-x",TRUE
"clinical diagnosis of metabolic disorders using untargeted metabolomic profiling and disease-specific networks learned from profiling data.","Scientific reports",2022,"10.1038/s41598-022-10415-5",TRUE
"prediction of postprocedural filter debris after transcarotid revascularization.","Vascular",2022,"10.1177/17085381221106325",FALSE
"differential integrated stress response and asparagine production drive symbiosis and therapy resistance of pancreatic adenocarcinoma cells.","Nature cancer",2022,"10.1038/s43018-022-00463-1",TRUE
"cross-linked actin networks (clans) affect stiffness and/or actin dynamics in transgenic transformed and primary human trabecular meshwork cells.","Experimental eye research",2022,"10.1016/j.exer.2022.109097",FALSE
"parasitic lung diseases.","European respiratory review : an official journal of the European Respiratory Society",2022,"10.1183/16000617.0093-2022",TRUE
"pgc1α overexpression preserves muscle mass and function in cisplatin-induced cachexia.","Journal of cachexia, sarcopenia and muscle",2022,"10.1002/jcsm.13035",TRUE
"traumatic brain injury vocational rehabilitation counselor competencies: implications for training and practice","Journal of Vocational Rehabilitation",2022,"10.3233/jvr-221198",FALSE
"single cell approaches reveal perturbed brain vascular molecules in alzheimer's disease","Alzheimer's & Dementia",2022,"10.1002/alz.063202",FALSE
"age-dependent formation of tmem106b amyloid filaments in human brains.","Nature",2022,"10.1038/s41586-022-04650-z",TRUE
"the east africa consortium for human papillomavirus and cervical cancer in women living with hiv/aids.","Annals of medicine",2022,"10.1080/07853890.2022.2067897",TRUE
"cannulation and decannulation techniques for neonatal ecmo.","Seminars in fetal & neonatal medicine",2022,"10.1016/j.siny.2022.101404",FALSE
"relationship between exercise intensity and stress levels among u.s. medical students.","Medical education online",2022,"10.1080/10872981.2022.2027651",TRUE
"getting to 100%: research priorities and unanswered questions to inform the us debate on universal health insurance coverage.","Journal of general internal medicine",2022,"10.1007/s11606-021-07234-1",TRUE
"adverse events following administration of covid-19 vaccines in saudi arabia.","Scientific reports",2022,"10.1038/s41598-022-23471-8",TRUE
"systematic literature review and meta-analysis of clinical outcomes and prognostic factors for melanoma brain metastases.","Frontiers in oncology",2022,"10.3389/fonc.2022.1025664",TRUE
"the conundrum of obesity and gastroparesis hospitalizations: a retrospective comparative analysis of hospitalization characteristics and disparities amongst socioeconomic and racial backgrounds in the united states.","Journal of neurogastroenterology and motility",2022,"10.5056/jnm21232",TRUE
"spillover: the approval of new medications for alzheimer's disease dementia will impact biomarker disclosure among asymptomatic research participants.","Journal of Alzheimer's disease : JAD",2022,"10.3233/jad-220113",TRUE
"internship program receives return on investment from nurse professional development efforts.","Journal for nurses in professional development",2022,"10.1097/nnd.0000000000000867",FALSE
"multimodal data analysis reveals that pancreatobiliary-type ampullary adenocarcinoma resembles pancreatic adenocarcinoma and differs from cholangiocarcinoma.","Journal of translational medicine",2022,"10.1186/s12967-022-03473-w",TRUE
"transcriptomic profiling in mild cognitive impairment using peripheral blood gene co‐expression networks","Alzheimer's & Dementia",2021,"10.1002/alz.056702",TRUE
"utilizing cytof to examine hematopoietic stem and progenitor phenotype.","Methods in molecular biology (Clifton, N.J.)",2022,"10.1007/978-1-0716-2679-5_8",FALSE
"ripk1 and ripk3 regulate tnfα-induced β-cell death in concert with caspase activity.","Molecular metabolism",2022,"10.1016/j.molmet.2022.101582",TRUE
"examining depression as a risk factor for cardiovascular disease in people with hiv: a systematic review.","Annals of behavioral medicine : a publication of the Society of Behavioral Medicine",2022,"10.1093/abm/kaab119",TRUE
"quantitative 3-dimensional imaging and tissue cytometry reveals lymphatic expansion in acute kidney injury.","Laboratory investigation; a journal of technical methods and pathology",2021,"10.1038/s41374-021-00609-2",TRUE
"early brain and abdominal oxygenation in extremely low birth weight infants.","Pediatric research",2022,"10.1038/s41390-022-02082-z",TRUE
"musculoskeletal deficits and cognitive impairment: epidemiological evidence and biological mechanisms.","Current osteoporosis reports",2022,"10.1007/s11914-022-00736-9",TRUE
"longitudinal early‐onset alzheimer's disease study (leads) genetic screening: initial results","Alzheimer's & Dementia",2021,"10.1002/alz.056493",TRUE
"integrating palliative care into nursing care.","The American journal of nursing",2022,"10.1097/01.naj.0000897124.77291.7d",TRUE
"the urgent need to improve childhood cancer cachexia.","Trends in cancer",2022,"10.1016/j.trecan.2022.07.005",TRUE
"sex and <i>apoe‐</i>ε<i>4</i> carrier effects on early‐onset alzheimer's disease pathology","Alzheimer's & Dementia",2022,"10.1002/alz.068743",FALSE
"scmr level ii/independent practitioner training guidelines for cardiovascular magnetic resonance: integration of a virtual training environment.","Journal of cardiovascular magnetic resonance : official journal of the Society for Cardiovascular Magnetic Resonance",2021,"10.1186/s12968-021-00836-y",TRUE
"current androgen receptor antagonists under investigation for resistant prostate cancer.","Expert review of anticancer therapy",2021,"10.1080/14737140.2022.2020651",FALSE
"a comprehensive literature review and meta-analysis of the prevalence of pan-cancer brca mutations, homologous recombination repair gene mutations, and homologous recombination deficiencies.","Environmental and molecular mutagenesis",2022,"10.1002/em.22505",FALSE
"age is no barrier for adults undergoing hct for aml in cr1: contemporary cibmtr analysis.","Bone marrow transplantation",2022,"10.1038/s41409-022-01650-5",TRUE
"correction: opportunities to implement a sustainable genomic medicine program: lessons learned from the ignite network.","Genetics in medicine : official journal of the American College of Medical Genetics",2021,"10.1038/s41436-020-01054-0",TRUE
"collaborative biostatistics and epidemiology in academic medical centres: a survey to assess relationships with health researchers and ethical implications","Stat",2022,"10.1002/sta4.481",TRUE
"artificial intelligence and prostate cancer: advances and challenges.","Urologia",2021,"10.1177/03915603211062409",FALSE
"obese gastroparesis inpatient admissions: trends and outcomes from 2007-2017 in the united states.","Annals of gastroenterology",2022,"10.20524/aog.2022.0702",TRUE
"factors associated with the intention to receive the covid-19 vaccine: cross-sectional national study.","JMIR public health and surveillance",2022,"10.2196/37203",TRUE
"removal of medicaid restrictions were associated with increased hepatitis c virus treatment rates, but disparities persist.","Journal of viral hepatitis",2022,"10.1111/jvh.13661",TRUE
"association of obesity with longer time to pregnancy.","Obstetrics and gynecology",2022,"10.1097/aog.0000000000004703",FALSE
"persistence of anti-sars-cov-2 spike igg antibodies following covid-19 vaccines.","Infection and drug resistance",2022,"10.2147/idr.s362848",TRUE
"105. long term surgical and patient reported outcomes after cross face nerve graft reconstruction in pediatric facial paralysis","Plastic and Reconstructive Surgery - Global Open",2022,"10.1097/01.gox.0000842736.50573.83",TRUE
"response.","Gastrointestinal endoscopy",2022,"10.1016/j.gie.2022.02.040",TRUE
"extension of retinofugal projections in an assembled model of human pluripotent stem cell-derived organoids.","Stem cell reports",2021,"10.1016/j.stemcr.2021.05.009",TRUE
"camkk2 knockout bone marrow cells collected/processed in low oxygen (physioxia) suggests camkk2 as a hematopoietic stem to progenitor differentiation fate determinant.","Stem cell reviews and reports",2022,"10.1007/s12015-021-10306-8",TRUE
"literature review of management of brain metastases from germ cell tumors.","Chinese clinical oncology",2022,"10.21037/cco-21-127",TRUE
"the genetic landscape of cardiovascular left-right patterning defects.","Current opinion in genetics & development",2022,"10.1016/j.gde.2022.101937",TRUE
"structures of α-synuclein filaments from human brains with lewy pathology.","Nature",2022,"10.1038/s41586-022-05319-3",TRUE
"outcomes of single dose covid-19 vaccines: eight month follow-up of a large cohort in saudi arabia.","Journal of infection and public health",2022,"10.1016/j.jiph.2022.04.001",TRUE
"standardized criteria increases palliative care consultation utilization in patients with end-stage liver disease: a pilot study.","The American journal of hospice & palliative care",2022,"10.1177/10499091221127984",FALSE
"the intersection of metabolism and inflammation is governed by the intracellular topology of hexokinases and the metabolic fate of glucose.","Immunometabolism (Cobham (Surrey, England))",2022,"10.1097/in9.0000000000000011",TRUE
"genome-wide interaction analysis of genetic variants with menopausal hormone therapy for colorectal cancer risk.","Journal of the National Cancer Institute",2022,"10.1093/jnci/djac094",TRUE
"acute kidney injury in hospitalized children with sickle cell anemia.","BMC nephrology",2022,"10.1186/s12882-022-02731-9",TRUE
"longitudinal gwas identifies novel genetic variants and complex traits associated with resilience to alzheimer's disease","Alzheimer's & Dementia",2022,"10.1002/alz.067816",FALSE
"the dangers of reused personal protective equipment: healthcare workers and workstation contamination.","The Journal of hospital infection",2022,"10.1016/j.jhin.2022.05.016",TRUE
"""i don't want to spend the rest of my life only going to a gender wellness clinic"": healthcare experiences of patients of a comprehensive transgender clinic.","Journal of general internal medicine",2022,"10.1007/s11606-022-07408-5",TRUE
"the bidirectional lung brain-axis of amyloid-β pathology: ozone dysregulates the peri-plaque microenvironment.","Brain : a journal of neurology",2022,"10.1093/brain/awac113",TRUE
"plasma p-tau231 and p-tau217 as state markers of amyloid-β pathology in preclinical alzheimer's disease.","Nature medicine",2022,"10.1038/s41591-022-01925-w",TRUE
"corticosteroid plus glycyrrhizin therapy for chronic drug- or herb-induced liver injury achieves biochemical and histological improvements: a randomised open-label trial.","Alimentary pharmacology & therapeutics",2022,"10.1111/apt.16902",TRUE
"manipulating the microbiome to enhance oral tolerance in food allergy.","Cellular immunology",2022,"10.1016/j.cellimm.2022.104633",TRUE
"increasing participant diversity in ad research: plans for digital screening, blood testing, and a community-engaged approach in the alzheimer's disease neuroimaging initiative 4.","Alzheimer's & dementia : the journal of the Alzheimer's Association",2022,"10.1002/alz.12797",TRUE
"tumor microenvironment heterogeneity an important mediator of prostate cancer progression and therapeutic resistance.","NPJ precision oncology",2022,"10.1038/s41698-022-00272-w",TRUE
"the alzheimer's disease sequencing project follow up study (adsp‐fus): increasing ethnic diversity in alzheimer's disease (ad) genetics research.","Alzheimer's & Dementia",2022,"10.1002/alz.068083",FALSE
"local control outcomes for combination of stereotactic radiosurgery and immunotherapy for non-small cell lung cancer brain metastases.","Journal of neuro-oncology",2022,"10.1007/s11060-022-03951-7",FALSE
"cox‐2‐hemmer: keine präventive wirkung gegen hautkrebs","Journal der Deutschen Dermatologischen Gesellschaft = Journal of the German Society of Dermatology : JDDG",2022,"10.1111/ddg.14649_g",FALSE
"calcimimetics alter periosteal and perilacunar bone matrix composition and material properties in early chronic kidney disease.","Journal of bone and mineral research : the official journal of the American Society for Bone and Mineral Research",2022,"10.1002/jbmr.4574",TRUE
"pancreatitis associated anxiety, depression, and stress: hypothesis, definition, and intervention.","Surgery open science",2022,"10.1016/j.sopen.2022.06.005",TRUE
"gearing up for the future: exploring facilitators and barriers to inform clinical trial design in frontotemporal lobar degeneration","Alzheimer's & Dementia",2021,"10.1002/alz.052495",TRUE
"resident research mentoring teams: a support program to increase resident research productivity [a64]","Obstetrics & Gynecology",2022,"10.1097/01.aog.0000826584.29461.e8",FALSE
"cellular and molecular interrogation of kidney biopsy specimens.","Current opinion in nephrology and hypertension",2021,"10.1097/mnh.0000000000000770",TRUE
"gastric bypass versus best medical treatment for diabetic kidney disease: 5 years follow up of a single-centre open label randomised controlled trial.","EClinicalMedicine",2022,"10.1016/j.eclinm.2022.101725",TRUE
"transcarotid revascularization timing and early postoperative outcomes in symptomatic patients.","Vascular and endovascular surgery",2022,"10.1177/15385744221146678",FALSE
"cryopreservation preserves cell-type composition and gene expression profiles in bone marrow aspirates from multiple myeloma patients.","Frontiers in genetics",2021,"10.3389/fgene.2021.663487",TRUE
"integrative ‐omics for discovery of network‐level disease biomarkers for alzheimer's disease","Alzheimer's & Dementia",2021,"10.1002/alz.053964",TRUE
"response to: can we successfully improve attentional impairments after brain injury with computer-based interventions? letter to the editor on ""evidence-based cognitive rehabilitation: systematic review of the literature from 2009 through 2014"".","Archives of physical medicine and rehabilitation",2022,"10.1016/j.apmr.2022.05.021",FALSE
"prognostic value of initial electrocardiography in predicting long-term all-cause mortality in covid-19.","Journal of electrocardiology",2022,"10.1016/j.jelectrocard.2022.10.003",TRUE
"patellar tilt does not affect patient reported outcomes after modern total knee arthroplasty.","The Knee",2021,"10.1016/j.knee.2021.11.013",FALSE
"addressing unmet needs for people with cancer cachexia: recommendations from a multistakeholder workshop.","Journal of cachexia, sarcopenia and muscle",2022,"10.1002/jcsm.12910",TRUE
"are burns a chronic condition? examining patient reported outcomes up to 20 years after burn injury-a burn model system national database investigation.","The journal of trauma and acute care surgery",2022,"10.1097/ta.0000000000003547",TRUE
"genetic data identify dual‐enrolled participants in alzheimer's disease and related dementia (adrd) studies","Alzheimer's & Dementia",2022,"10.1002/alz.066536",FALSE
"modern approaches to the management of brain metastases: embracing a multi-modal paradigm.","Chinese clinical oncology",2022,"10.21037/cco-2022-1",TRUE
"t1 signal intensity ratio of the pancreas as an imaging biomarker for the staging of chronic pancreatitis.","Abdominal radiology (New York)",2022,"10.1007/s00261-022-03611-4",TRUE
"a reference tissue atlas for the human kidney.","Science advances",2022,"10.1126/sciadv.abn4965",TRUE
"stress-delta b-type natriuretic peptide does not exclude acs in the ed.","The journal of applied laboratory medicine",2022,"10.1093/jalm/jfac027",TRUE
"molecular analysis of adenocarcinomas of the rete testis demonstrates frequent alterations in genes involved in cell cycle regulation.","Histopathology",2022,"10.1111/his.14661",FALSE
"30-minute cmr for common clinical indications: a society for cardiovascular magnetic resonance white paper.","Journal of cardiovascular magnetic resonance : official journal of the Society for Cardiovascular Magnetic Resonance",2022,"10.1186/s12968-022-00844-6",TRUE
"consensus development of a core content for a standardized medical toxicology curriculum for medical students.","Journal of medical toxicology : official journal of the American College of Medical Toxicology",2022,"10.1007/s13181-021-00874-z",TRUE
"bmi1 regulates wnt signaling in hematopoietic stem and progenitor cells.","Stem cell reviews and reports",2021,"10.1007/s12015-021-10253-4",TRUE
"structural covariance of the ventral visual stream predicts posttraumatic intrusion and nightmare symptoms: a multivariate data fusion analysis.","Translational psychiatry",2022,"10.1038/s41398-022-02085-8",TRUE
"improving bone health by optimizing the anabolic action of wnt inhibitor multitargeting.","JBMR plus",2021,"10.1002/jbm4.10462",TRUE
"skin sympathetic nerve activity and the short-term qt interval variability in patients with electrical storm.","Frontiers in physiology",2021,"10.3389/fphys.2021.742844",TRUE
"sex differences in risk for alzheimer's disease with extended maternal and paternal family history and vascular risk factors. the cache county study.","Alzheimer's & Dementia",2022,"10.1002/alz.062914",TRUE
"multiomics in primary and metastatic breast tumors from the aurora us network finds microenvironment and epigenetic drivers of metastasis.","Nature cancer",2022,"10.1038/s43018-022-00491-x",TRUE
"sars-cov-2 vaccination and risk of severe covid-19 outcomes in patients with autoimmune hepatitis.","Journal of autoimmunity",2022,"10.1016/j.jaut.2022.102906",TRUE
"spatial transcriptomics and the kidney.","Current opinion in nephrology and hypertension",2022,"10.1097/mnh.0000000000000781",TRUE
"hand-in-hand advances in microscopy and plasmodium nuclear biology.","Trends in parasitology",2022,"10.1016/j.pt.2022.03.007",FALSE
"pragmatic trials in long-term care: research challenges and potential solutions in relation to key areas of care.","Geriatric nursing (New York, N.Y.)",2022,"10.1016/j.gerinurse.2022.02.007",TRUE
"diagnostic and prognostic performance to detect alzheimer's disease and clinical progression of a novel assay for plasma p-tau217.","Alzheimer's research & therapy",2022,"10.1186/s13195-022-01005-8",TRUE
"the potential proconvulsant effects of cannabis: a scoping review.","Journal of medical toxicology : official journal of the American College of Medical Toxicology",2022,"10.1007/s13181-022-00886-3",TRUE
"correction to: selective kappa-opioid antagonism ameliorates anhedonic behavior: evidence from the fast-fail trial in mood and anxiety spectrum disorders (fast-mas).","Neuropsychopharmacology : official publication of the American College of Neuropsychopharmacology",2021,"10.1038/s41386-021-01145-9",TRUE
"sharing our journey: implementing a multicounty substance use prevention program in area schools.","NASN school nurse (Print)",2022,"10.1177/1942602x211067225",FALSE
"ncrad family study and nia‐load brain tissue: a ncrad resource","Alzheimer's & Dementia",2021,"10.1002/alz.056284",TRUE
