"Title","Journal.Name","Pub.Year","DOI","OA.Flag"
"risk of ventricular tachycardia and sudden cardiac arrest associated with qt interval-prolonging drugs in patients with heart failure with preserved ejection fraction","Journal of the American College of Cardiology",2022,"10.1016/s0735-1097(22)01125-1",TRUE
"physical symptoms, distress, and functional disability in youth with chronic orthostatic intolerance.","Journal of pediatric psychology",2022,"10.1093/jpepsy/jsac052",TRUE
"luxury fashion brand customers' perceptions of mobile marketing: evidence of multiple communications and marketing channels","Journal of Retailing and Consumer Services",2022,"10.1016/j.jretconser.2022.102944",TRUE
"u.s. department of education data document a declining 17-year trend in black college student graduation rates","Journal of Underrepresented & Minority Progress",2022,"10.32674/jump.v6i2.4438",TRUE
"introduction to ion transport and membrane interactions in vascular health and disease.","Current topics in membranes",2022,"10.1016/bs.ctm.2022.09.006",FALSE
"severe maternal morbidity and informatics.","searchRxiv",2022,"10.1079/searchrxiv.2022.00017",TRUE
"accuracy of chest computed tomography in distinguishing cystic pleuropulmonary blastoma from benign congenital lung malformations in children.","JAMA network open",2022,"10.1001/jamanetworkopen.2022.19814",TRUE
"contemporary maternal and fetal outcomes in the treatment of lqts during pregnancy: is nadolol bad for the fetus?","Heart rhythm",2022,"10.1016/j.hrthm.2022.05.001",FALSE
"privacy may be more important in beijing than in hong kong in location-based services","International Journal of Internet Marketing and Advertising",2022,"10.1504/ijima.2022.126715",FALSE
"physician awareness of immune-related adverse events from checkpoint inhibitors.","Journal of Clinical Oncology",2022,"10.1200/jco.2022.40.16_suppl.6571",FALSE
"association of genetic predisposition and physical activity with risk of gestational diabetes in nulliparous women.","JAMA network open",2022,"10.1001/jamanetworkopen.2022.29158",TRUE
"coenzyme q10 prevents scopolamine associated hippocampal-dependent memory deficits in mice","SSRN Electronic Journal",2021,"10.2139/ssrn.3977763",FALSE
"lesbian, gay, bisexual, and/or transgender (lgbt) cultural competency across the intersectionalities of gender identity, sexual orientation, and race among healthcare professionals.","PloS one",2022,"10.1371/journal.pone.0277682",TRUE
"integrating coronary atherosclerosis burden and progression with coronary artery disease risk factors to guide therapeutic decision making.","The American journal of medicine",2022,"10.1016/j.amjmed.2022.10.021",TRUE
"erector spinae plane block versus transversus abdominis plane block in laparoscopic hysterectomy.","Pain management",2022,"10.2217/pmt-2022-0037",TRUE
"game on, washington! examining american sport's response to the uvalde massacre","Journal of Public and Nonprofit Affairs",2022,"10.20899/jpna.8.3.445-454",TRUE
"identifying genetic markers enriched by brain imaging endophenotypes in alzheimer's disease.","BMC medical genomics",2022,"10.1186/s12920-022-01323-8",TRUE
"biomechanical evaluation of 2 common approaches for total elbow arthroplasty: triceps tongue compared with triceps reflecting.","The Journal of hand surgery",2022,"10.1016/j.jhsa.2021.12.004",FALSE
"escalating the 2022 hajj during the third year of the covid-19 pandemic.","Journal of travel medicine",2022,"10.1093/jtm/taac059",TRUE
"racial and ethnic disparities in acute care utilization among patients with glomerular disease.","American journal of kidney diseases : the official journal of the National Kidney Foundation",2022,"10.1053/j.ajkd.2022.08.010",TRUE
"comparison of intrathecal baclofen pump insertion and selective dorsal rhizotomy for nonambulatory children with predominantly spastic cerebral palsy.","Journal of neurosurgery. Pediatrics",2022,"10.3171/2022.4.peds21576",FALSE
"ispad clinical practice consensus guidelines 2022: managing diabetes in preschoolers.","Pediatric diabetes",2022,"10.1111/pedi.13427",TRUE
"p8: development of a physiologic control algorithm for simultaneous cavopulmonary and ventricular assist device support","ASAIO Journal",2022,"10.1097/01.mat.0000841248.28722.64",TRUE
"primary graft dysfunction grade 3 following pediatric lung transplantation is associated with chronic lung allograft dysfunction.","The Journal of heart and lung transplantation : the official publication of the International Society for Heart Transplantation",2022,"10.1016/j.healun.2022.12.014",FALSE
"palpitations on testosterone","Journal of the American College of Cardiology",2022,"10.1016/s0735-1097(22)04362-5",TRUE
"persistent ventral anterior cingulate cortex and resolved amygdala hyper-responses to negative outcomes after depression remission: a combined cross-sectional and longitudinal study.","Biological psychiatry",2022,"10.1016/j.biopsych.2022.09.003",FALSE
"437 safety and efficacy of immune checkpoint inhibitors (ici) in patients living with hiv (plwh) and metastatic non-small cell lung cancer (nsclc): a matched cohort study from the international catch-it consortium","Regular and Young Investigator Award Abstracts",2022,"10.1136/jitc-2022-sitc2022.0437",TRUE
"do local-scale context dependencies shape how ectomycorrhizal fungal diversity structures with reduced or sustained experimental n addition?","Pedobiologia",2022,"10.1016/j.pedobi.2022.150791",TRUE
"contemporary trends in hospitalizations for comorbid chronic liver disease and substance use disorders.","Clinical and translational gastroenterology",2021,"10.14309/ctg.0000000000000372",TRUE
"balancing demands: determinants of burnout reported by fellows in pulmonary and critical care medicine.","ATS scholar",2021,"10.34197/ats-scholar.2020-0097oc",TRUE
"abstract ct224: phase ib study of the safety and efficacy of gemtuzumab ozogamicin (go) and venetoclax in patients with relapsed or refractory cd33+ acute myeloid leukemia: big ten cancer research consortium btcrc-aml17-113","Cancer Research",2021,"10.1158/1538-7445.am2021-ct224",FALSE
"sh3bp2 deficiency ameliorates murine systemic lupus erythematosus.","International journal of molecular sciences",2021,"10.3390/ijms22084169",TRUE
"the location of employment in large urban areas, 2002 and 2010","SSRN Electronic Journal",2022,"10.2139/ssrn.4061922",FALSE
"multicellular spheroids as in vitro models of oxygen depletion during flash irradiation.","International journal of radiation oncology, biology, physics",2021,"10.1016/j.ijrobp.2021.01.050",FALSE
"deep-learning neural network prediction of a solar-based absorption chiller cooling system performance using waste heat","Sustainable Energy Technologies and Assessments",2022,"10.1016/j.seta.2022.102683",FALSE
"one year into the pandemic: the impacts of social vulnerability on covid-19 outcomes and urban-rural differences in the conterminous united states.","International journal of environmental health research",2021,"10.1080/09603123.2021.1979196",FALSE
"linguistic policies for african american language speakers: moving from anti-blackness to pro-blackness","Theory Into Practice",2021,"10.1080/00405841.2021.1911576",FALSE
"the hedgehog signaling pathway is expressed in the adult mouse hypothalamus and modulated by fasting.","eNeuro",2021,"10.1523/eneuro.0276-21.2021",TRUE
"multidisciplinary treatment of deep non-carious cervical lesion with a cad/cam chairside restoration in combination with periodontal surgery: a 60-month follow-up technique report","Clinical advances in periodontics",2021,"10.1002/cap.10152",FALSE
"metal-free visible-light-promoted c(sp3)–h functionalization of aliphatic cyclic ethers using trace o2","Green chemistry : an international journal and green chemistry resource : GC",2021,"10.1039/d1gc03482k",TRUE
"early muscle gene expression changes with eccentric exercise uniquely associated with peak strength loss","Medicine & Science in Sports & Exercise",2022,"10.1249/01.mss.0000877080.67155.af",TRUE
"physical activity and risk of benign proliferative epithelial disorders of the breast, in the women's health initiative.","International journal of epidemiology",2021,"10.1093/ije/dyab113",TRUE
"""d"" matters in recombinant aav dna packaging.","Molecular therapy : the journal of the American Society of Gene Therapy",2021,"10.1016/j.ymthe.2021.05.002",TRUE
"pain-related injustice appraisals in youth with sickle cell disease: a preliminary investigation.","Pain medicine (Malden, Mass.)",2021,"10.1093/pm/pnab001",TRUE
"vertebral body adherent allogeneic mesenchymal stromal cells increase in vivo perfusion and improve muscle function in diabetic mouse models of critical limb-threatening ischemia","Journal of Vascular Surgery",2022,"10.1016/j.jvs.2022.03.759",TRUE
"variability in adenoma detection rate in control groups of randomized colonoscopy trials","SSRN Electronic Journal",2022,"10.2139/ssrn.4104366",FALSE
"crt-200.08 outcomes of acute coronary syndrome in patients with coronavirus 2019 infection: a systematic review and meta-analysis","JACC: Cardiovascular Interventions",2022,"10.1016/j.jcin.2022.01.155",TRUE
"radiation-induced pancreatic cancer cell killing by simultaneous inhibition of nf-kb and warburg metabolism","Free Radical Biology and Medicine",2022,"10.1016/j.freeradbiomed.2022.10.297",FALSE
"radiomic phenotypes distinguish atypical teratoid/rhabdoid tumors from medulloblastoma.","AJNR. American journal of neuroradiology",2021,"10.3174/ajnr.a7200",TRUE
"hospital value-based purchasing: how acute care advanced practice nurses demonstrate value.","Journal of the American Association of Nurse Practitioners",2021,"10.1097/jxx.0000000000000606",TRUE
"advancing nursing leadership science through an innovative research-practice partnership.","The Journal of nursing administration",2022,"10.1097/nna.0000000000001143",FALSE
"preliminary evidence for the efficacy of single-session transcranial direct current stimulation to the ventrolateral prefrontal cortex for reducing subclinical paranoia in healthy individuals.","The British journal of clinical psychology",2021,"10.1111/bjc.12297",FALSE
"spatiotemporal comparison of drought in shaanxi–gansu–ningxia from 2003 to 2020 using various drought indices in google earth engine","Remote Sensing",2022,"10.3390/rs14071570",TRUE
"response to letter to the editor regarding the article ""impact of caffeine on metabolic activity and biofilm formation of candida albicans on acrylic denture resin in the presence of nicotine"".","The Journal of prosthetic dentistry",2021,"10.1016/j.prosdent.2021.08.017",FALSE
"readmission in acute pancreatitis: etiology, risk factors, and opportunities for improvement","SSRN Electronic Journal",2022,"10.2139/ssrn.4072050",FALSE
"first-in-human, phase 1 dose-escalation study of biparatopic anti-her2 antibody-drug conjugate medi4276 in patients with her2-positive advanced breast or gastric cancer.","Molecular cancer therapeutics",2021,"10.1158/1535-7163.mct-20-0014",TRUE
"36. clinical utility of copy number alteration analysis in the evaluation of melanocytic lesions for diagnosis and prognosis","Cancer Genetics",2022,"10.1016/j.cancergen.2022.10.039",FALSE
"social, economic, and health effects of the covid-19 pandemic on adolescents retained in or recently disengaged from hiv care in kenya.","PloS one",2021,"10.1371/journal.pone.0257210",TRUE
"dynamic measurement of orthodontic force using a tooth movement simulation system based on a wax model.","Technology and health care : official journal of the European Society for Engineering and Medicine",2021,"10.3233/thc-202451",FALSE
"introduction to perspectives","Administration & Society",2021,"10.1177/00953997211053483",FALSE
"gut reaction: habitual dietary nitrate intake as a modulator of skeletal muscle contractile function.","The Journal of nutrition",2021,"10.1093/jn/nxab023",TRUE
"correction: bevacizumab-induced hypertension and proteinuria: a genome-wide study of more than 1000 patients.","British journal of cancer",2021,"10.1038/s41416-021-01617-1",TRUE
"the genius of the zebrafish model: insights on development and disease.","Biomedicines",2021,"10.3390/biomedicines9050577",TRUE
"differential effects of quinine adulteration of alcohol on seeking and drinking.","Alcohol (Fayetteville, N.Y.)",2021,"10.1016/j.alcohol.2021.01.003",TRUE
"studying battery range and range anxiety for electric vehicles based on real travel demands","Proceedings of the Human Factors and Ergonomics Society Annual Meeting",2021,"10.1177/1071181321651243",FALSE
"discharge pulmonary artery pulsatility index predicts morbidity and mortality after acute heart failure: from the escape trial","American Heart Journal Plus: Cardiology Research and Practice",2021,"10.1016/j.ahjo.2021.100003",TRUE
"natural gamma transmutation studies","Bulletin of the AAS",2021,"10.3847/25c2cfeb.78151830",TRUE
"pharmacological inhibition of carbonic anhydrase ix and xii to enhance targeting of acute myeloid leukaemia cells under hypoxic conditions.","Journal of cellular and molecular medicine",2021,"10.1111/jcmm.17027",TRUE
"melatonin receptor 1a, but not 1b, knockout decreases biliary damage and liver fibrosis during cholestatic liver injury.","Hepatology (Baltimore, Md.)",2021,"10.1002/hep.32233",TRUE
"employment density does not decline as a negative exponential function of distance from the center","SSRN Electronic Journal",2022,"10.2139/ssrn.4197371",FALSE
"correction: flexible lipid nanomaterials studied by nmr spectroscopy.","Physical chemistry chemical physics : PCCP",2021,"10.1039/d1cp90155a",TRUE
"gender-responsive language in the national policy guidelines for immunization in kenya and changes in prevalence of tetanus vaccination among women, 2008–09 to 2014: a mixed methods study","Women's Studies International Forum",2021,"10.1016/j.wsif.2021.102476",TRUE
"effects of polygenic risk for suicide attempt and risky behavior on brain structure in young people with familial risk of bipolar disorder.","American journal of medical genetics. Part B, Neuropsychiatric genetics : the official publication of the International Society of Psychiatric Genetics",2021,"10.1002/ajmg.b.32879",TRUE
"s3111 an unusual case of acute liver failure secondary to autoimmune hepatitis (aih) from drug-induced liver injury (dili)","American Journal of Gastroenterology",2022,"10.14309/01.ajg.0000869084.75806.a5",TRUE
"characterizing and quantifying the temporal relationship between structural and functional change in glaucoma.","PloS one",2021,"10.1371/journal.pone.0249212",TRUE
"generation of the tumor-suppressive secretome from tumor cells.","Theranostics",2021,"10.7150/thno.61006",TRUE
"aligning information literacy and evidence-based dentistry concepts in a rubric to improve dental education.","Medical reference services quarterly",2021,"10.1080/02763869.2021.1912580",FALSE
"impact of subcutaneous and visceral fat adiposity in patients with colorectal cancer.","Clinical nutrition (Edinburgh, Scotland)",2021,"10.1016/j.clnu.2021.10.001",FALSE
"2020 women in thoracic surgery update on the status of women in cardiothoracic surgery.","The Annals of thoracic surgery",2021,"10.1016/j.athoracsur.2021.03.091",FALSE
"student's emotional experience and social interaction using zoom platform for online learning during covid-19 pandemic/ pengalaman emosional dan interaksi sosial mahasiswa dalam menggunakan sarana zoom untuk pembelajaran online selama pandemi covid-19","Edulab : Majalah Ilmiah Laboratorium Pendidikan",2022,"10.14421/edulab.2022.71.04",TRUE
"enhanced energy transfer from nitrogen-vacancy centers to three-dimensional graphene heterostructures by laser nanoshaping","Advanced Optical Materials",2021,"10.1002/adom.202001830",FALSE
"ehbb: a randomised controlled trial of virtual reality or video for neonatal resuscitation refresher training in healthcare workers in resource-scarce settings.","BMJ open",2021,"10.1136/bmjopen-2020-048506",TRUE
"actin at stereocilia tips is regulated by mechanotransduction and adf/cofilin.","Current biology : CB",2021,"10.1016/j.cub.2020.12.006",TRUE
"statin use moderates the beneficial effects of aerobic exercise on older adults' performances on the stroop test: a subanalysis.","Experimental gerontology",2021,"10.1016/j.exger.2021.111277",TRUE
"mechanical loading attenuates breast cancer-associated bone metastasis in obese mice by regulating the bone marrow microenvironment.","Journal of cellular physiology",2021,"10.1002/jcp.30314",TRUE
"adenoma detection rate (adr) irrespective of indication is comparable to screening adr: implications for quality monitoring.","Clinical gastroenterology and hepatology : the official clinical practice journal of the American Gastroenterological Association",2021,"10.1016/j.cgh.2021.02.028",FALSE
"surgical interventions during end-of-life hospitalizations in children's hospitals.","Pediatrics",2021,"10.1542/peds.2020-047464",FALSE
"differential prediction and disparate impact of pretrial risk assessments in practice: a multi-site evaluation","Journal of Experimental Criminology",2022,"10.1007/s11292-021-09492-9",FALSE
"first world consensus conference on pancreas transplantation: part ii – recommendations","American journal of transplantation : official journal of the American Society of Transplantation and the American Society of Transplant Surgeons",2021,"10.1111/ajt.16750",TRUE
"apoa5 lowers triglyceride levels via suppression of angptl3/8-mediated lpl inhibition.","Journal of lipid research",2021,"10.1016/j.jlr.2021.100068",TRUE
"dietary fluoride intake during pregnancy and neurodevelopment in toddlers: a prospective study in the progress cohort.","Neurotoxicology",2021,"10.1016/j.neuro.2021.08.015",TRUE
"finerenone reduces risk of incident heart failure in patients with chronic kidney disease and type 2 diabetes: analyses from the figaro-dkd trial","Circulation",2021,"10.1161/circulationaha.121.057983",TRUE
"oral vancomycin, ursodeoxycholic acid or no therapy for pediatric primary sclerosing cholangitis: a matched analysis","Hepatology (Baltimore, Md.)",2021,"10.1002/hep.31560",TRUE
"anticancer effect of moringa oleifera leaves extract against lung cancer cell line via induction of apoptosis","Advances in Cancer Biology - Metastasis",2022,"10.1016/j.adcanc.2022.100072",TRUE
"severe little ice age drought in the midcontinental united states during the mississippian abandonment of cahokia.","Scientific reports",2021,"10.1038/s41598-021-92900-x",TRUE
"sociopolitical values and social institutions: studying work and health equity through the lens of political economy.","SSM - population health",2021,"10.1016/j.ssmph.2021.100787",TRUE
"genetic mapping and identification of a qtl determining tolerance to freezing stress in fragaria vesca l.","PloS one",2021,"10.1371/journal.pone.0248089",TRUE
"aortic pulsatility index, a new hemodynamic assessment, predicts cardiovascular death at 1 year.","Journal of Cardiac Failure",2022,"10.1016/j.cardfail.2022.03.215",FALSE
"association of edentulism with various chronic diseases in mexican elders 60+ years: results of a population-based survey.","Healthcare (Basel, Switzerland)",2021,"10.3390/healthcare9040404",TRUE
"weakly-supervised cross-domain adaptation for endoscopic lesions segmentation","IEEE Transactions on Circuits and Systems for Video Technology",2021,"10.1109/tcsvt.2020.3016058",TRUE
"a selective review of smoking cessation interventions in the emergency department","Emergency Cancer Care",2022,"10.1186/s44201-022-00006-5",TRUE
"correction to: acg clinical guidelines: prevention, diagnosis, and treatment of clostridioides difficile infections.","The American journal of gastroenterology",2021,"10.14309/ajg.0000000000001529",FALSE
"six blind men and one elephant: proposing an integrative framework to advance research and practice in justice philanthropy","Journal of Public and Nonprofit Affairs",2022,"10.20899/jpna.8.3.349-374",TRUE
"planning jagathon: commitment and social identities","Events and Tourism Review",2022,"10.18060/26303",TRUE
"vaginal progesterone for preterm birth prevention in women with arrested preterm labor.","The journal of maternal-fetal & neonatal medicine : the official journal of the European Association of Perinatal Medicine, the Federation of Asia and Oceania Perinatal Societies, the International Society of Perinatal Obstetricians",2021,"10.1080/14767058.2021.1963705",FALSE
"willingness and ability of oral health care workers to work during the covid-19 pandemic.","Journal of the American Dental Association (1939)",2021,"10.1016/j.adaj.2021.04.021",TRUE
"effect of hydrogel-based antibiotic intracanal medicaments on crown discoloration","Restorative dentistry & endodontics",2021,"10.5395/rde.2021.46.e52",TRUE
"advancing surgical education","Global Surgical Education - Journal of the Association for Surgical Education",2022,"10.1007/s44186-022-00011-6",TRUE
"how do peace psychologists address the violent assaults on black people’s lives? a review of studies published in the peace and conflict journal.","Peace and Conflict: Journal of Peace Psychology",2021,"10.1037/pac0000515",FALSE
"asgct 2022 – bigger than ever","Molecular Therapy",2022,"10.1016/j.ymthe.2022.06.009",TRUE
"the effect of dopamine on model lipid membrane structure","Biophysical Journal",2022,"10.1016/j.bpj.2021.11.918",TRUE
"implementation of the data-driven analytics protocol through facility management and real estate industry cases","Journal of Management in Engineering",2022,"10.1061/(asce)me.1943-5479.0000894",FALSE
"cultural competence: reply to taylor et al.","Pediatric radiology",2021,"10.1007/s00247-021-05136-2",TRUE
"adolescent social networks matter for suicidal trajectories: disparities across race/ethnicity, sex, sexual identity, and socioeconomic status.","Psychological medicine",2021,"10.1017/s0033291721000465",TRUE
"vaccinations against covid-19 may have averted up to 140,000 deaths in the united states.","Health affairs (Project Hope)",2021,"10.1377/hlthaff.2021.00619",TRUE
"posb242 telemedicine use during year 2020 of the covid-19 pandemic in older us medicare beneficiaries","Value in Health",2022,"10.1016/j.jval.2021.11.783",TRUE
"biologic augmentation during meniscal repair","The journal of knee surgery",2021,"10.1055/s-0041-1739198",FALSE
"the size-mobility relationship of ions, aerosols, and other charged particle matter.","Journal of Aerosol Science",2021,"10.1016/j.jaerosci.2020.105659",FALSE
"satellite subgenomic particles are key regulators of adeno-associated virus life cycle.","Viruses",2021,"10.3390/v13061185",TRUE
"groundwater recharge to address seawater intrusion and supply in an urban coastal aquiferorange county water district, orange county, california","Case Studies in the Environment",2021,"10.1525/cse.2021.1223118",TRUE
"identification and characterization of novel proteins from arizona bark scorpion venom that inhibit nav1.8, a voltage-gated sodium channel regulator of pain signaling.","Toxins",2021,"10.3390/toxins13070501",TRUE
"longitudinal milestone assessment extending through subspecialty training: the relationship between acgme internal medicine residency milestones and subsequent pulmonary and critical care fellowship milestones.","Academic medicine : journal of the Association of American Medical Colleges",2021,"10.1097/acm.0000000000004165",FALSE
"comparing symptoms and emotion recognition in african american and white samples with schizophrenia.","International journal of psychology : Journal international de psychologie",2021,"10.1002/ijop.12765",FALSE
"finerenone in predominantly advanced ckd and type 2 diabetes with or without sodium-glucose cotransporter-2 inhibitor therapy","Kidney international reports",2021,"10.1016/j.ekir.2021.10.008",TRUE
"quality control questions on amazon’s mechanical turk (mturk): a randomized trial of impact on the usaudit, phq-9, and gad-7","Behavior research methods",2021,"10.3758/s13428-021-01665-8",TRUE
"toward convergence in free energy calculations for protein conformational changes: a case study on the thin gate of mhp1 transporter.","Journal of chemical theory and computation",2021,"10.1021/acs.jctc.1c00585",FALSE
"teaching mentoring in radiation oncology (teamro): a roecsg gme multi-institutional pilot study on teaching mentorship skills to residents","International Journal of Radiation Oncology*Biology*Physics",2022,"10.1016/j.ijrobp.2022.06.011",FALSE
"the synchronicity of covid-19 disparities: statewide epidemiologic trends in sars-cov-2 morbidity, hospitalization, and mortality among racial minorities and in rural america.","PloS one",2021,"10.1371/journal.pone.0255063",TRUE
"the development and initial findings of a study of a prospective adult research cohort with inflammatory bowel disease (sparc ibd).","Inflammatory bowel diseases",2021,"10.1093/ibd/izab071",TRUE
"long-term outcome of autotransplantation of a complete root formed a mandibular third molar","Case reports in dentistry",2021,"10.1155/2021/5512804",TRUE
"entrustable professional activities framework for assessment in predoctoral dental education, developed using a modified delphi process.","Journal of dental education",2021,"10.1002/jdd.12620",FALSE
"higher requirements of loop diuretics in heart failure with chronic kidney disease regardless of degree of left ventricular dysfunction: from the hf-action trial.","Journal of cardiac failure",2021,"10.1016/j.cardfail.2021.05.011",FALSE
"black americans' perspectives on ally confrontations of racial prejudice","Journal of Experimental Social Psychology",2022,"10.1016/j.jesp.2022.104337",FALSE
