"Title","Journal.Name","Pub.Year","DOI","OA.Flag"
"everted diverticula with endoscopic mucosal changes mimicking serrated lesions (with video).","Gastrointestinal endoscopy",2022,"10.1016/j.gie.2022.09.001",FALSE
"multisystem inflammatory syndrome in children - initial therapy and outcomes.","The New England journal of medicine",2021,"10.1056/nejmoa2102605",TRUE
"comparative effectiveness of carotid stenting to medical therapy among patients with asymptomatic carotid stenosis.","Stroke",2022,"10.1161/strokeaha.121.036178",TRUE
"setd6 regulates e2-dependent human papillomavirus transcription.","Journal of virology",2022,"10.1128/jvi.01295-22",TRUE
"kidney disease and congenital heart disease: partnership for life.","Frontiers in physiology",2022,"10.3389/fphys.2022.970389",TRUE
"loss of apical sodium bile acid transporter alters bile acid circulation and reduces biliary damage in cholangitis.","American journal of physiology. Gastrointestinal and liver physiology",2022,"10.1152/ajpgi.00112.2022",TRUE
"skeletal muscle contraction kinetics and ampk responses are modulated by the adenine nucleotide degrading enzyme ampd1.","Journal of applied physiology (Bethesda, Md. : 1985)",2022,"10.1152/japplphysiol.00035.2022",TRUE
"addendum: critical windows of fluoride neurotoxicity in canadian children.","Environmental research",2022,"10.1016/j.envres.2022.114468",TRUE
"impact of adverse health outcomes (ahos) on self-reported physical and mental health in u.s. testicular cancer survivors (tcs).","Journal of Clinical Oncology",2022,"10.1200/jco.2022.40.16_suppl.12080",FALSE
"impact of withdrawal time on adenoma detection rate: results from a prospective multicenter trial.","Gastrointestinal endoscopy",2022,"10.1016/j.gie.2022.09.031",FALSE
"albumin uptake and processing by the proximal tubule: physiological, pathological, and therapeutic implications.","Physiological reviews",2022,"10.1152/physrev.00014.2021",TRUE
"readily available tissue-engineered vascular grafts derived from human induced pluripotent stem cells.","Circulation research",2022,"10.1161/circresaha.121.320315",TRUE
"segregating the effects of ferric citrate-mediated iron utilization and fgf23 in a mouse model of ckd.","Physiological reports",2022,"10.14814/phy2.15307",TRUE
"influence of cyp2b6 pharmacogenetics on stereoselective inhibition and induction of bupropion metabolism by efavirenz in healthy volunteers.","The Journal of pharmacology and experimental therapeutics",2022,"10.1124/jpet.122.001277",TRUE
"utility of fluorescence in situ hybridization in clinical and research applications.","Clinics in laboratory medicine",2022,"10.1016/j.cll.2022.09.020",FALSE
"identification of signaling and functional adaptations of hematopoietic stem/progenitor cells via generation of a low oxygen landscape","The FASEB Journal",2022,"10.1096/fasebj.2022.36.s1.r5506",FALSE
"development of a competency-based radiology clerkship using categorical and statistical analysis of assessment.","Journal of the American College of Radiology : JACR",2022,"10.1016/j.jacr.2022.01.002",FALSE
"quantification of murine myocardial infarct size using 2-d and 4-d high-frequency ultrasound.","American journal of physiology. Heart and circulatory physiology",2022,"10.1152/ajpheart.00476.2021",TRUE
"effect of inclined positioning on first-pass success during endotracheal intubation: a systematic review and meta-analysis.","Emergency medicine journal : EMJ",2022,"10.1136/emermed-2021-211968",FALSE
"hyaluronic acid as an adjunct to microfracture in the treatment of osteochondral lesions of the talus: a systematic review of randomized controlled trials.","BMC musculoskeletal disorders",2022,"10.1186/s12891-022-05236-6",TRUE
"atypical cartilage in type ii germ cell tumors of the mediastinum show significantly different patterns of idh1/2 mutations from conventional chondrosarcoma.","Modern pathology : an official journal of the United States and Canadian Academy of Pathology, Inc",2022,"10.1038/s41379-022-01106-7",TRUE
"intrathecal baclofen and opioid therapy: cerebrospinal fluid leak and infection incidence, risk factors, and outcomes.","World neurosurgery",2022,"10.1016/j.wneu.2022.12.039",FALSE
"rela is an essential target for enhancing cellular responses to the dna repair/ref-1 redox signaling protein and restoring perturbated cellular redox homeostasis in mouse pdac cells.","Frontiers in oncology",2022,"10.3389/fonc.2022.826617",TRUE
"delay discounting and alcohol consumption correlate with dorsal anterior insula activation during choice in nontreatment-seeking heavy drinkers.","Alcoholism, clinical and experimental research",2022,"10.1111/acer.14888",TRUE
"acceptability of an mhealth app for youth with substance use and mental health needs: iterative, mixed methods design.","JMIR formative research",2021,"10.2196/30268",TRUE
"fatal melanoma with a novel myo5a-braf fusion and small associated conventional nevus: a case report and review of literature.","Journal of cutaneous pathology",2022,"10.1111/cup.14263",TRUE
"top pediatric dermatology twitter post characteristics and trends from 2020 to 2021: content analysis.","JMIR dermatology",2022,"10.2196/37029",TRUE
"impact of gastrostomy tube and nutritional monitoring on interstage outcomes following stage 1 norwood palliation","Pediatrics",2021,"10.1542/peds.147.3ma4.353a",FALSE
"exosomal transfer of dna methyl-transferase mrna induces an immunosuppressive phenotype in human monocytes.","Shock (Augusta, Ga.)",2022,"10.1097/shk.0000000000001928",TRUE
"molecular landscaping of exosomal protein and mirna cargo in acute myeloid leukemia","Blood",2022,"10.1182/blood-2022-169595",TRUE
"do ask, do tell: understanding disclosure of sexuality and implications among msm active duty service members.","Military medicine",2022,"10.1093/milmed/usac209",TRUE
"hepatitis b virus x protein counteracts high mobility group box 1 protein-mediated epigenetic silencing of covalently closed circular dna.","PLoS pathogens",2022,"10.1371/journal.ppat.1010576",TRUE
"weight gain among treatment-naïve persons with hiv receiving dolutegravir in kenya.","Journal of acquired immune deficiency syndromes (1999)",2022,"10.1097/qai.0000000000003087",TRUE
"coxiella burnetii sterol-modifying protein stmp1 regulates cholesterol in the intracellular niche.","mBio",2022,"10.1128/mbio.03073-21",TRUE
"molecular genetic mechanisms in age-related macular degeneration.","Genes",2022,"10.3390/genes13071233",TRUE
"assessing attitudes about returning to in‐person learning among physician assistant students using q methodology","The FASEB Journal",2022,"10.1096/fasebj.2022.36.s1.r5029",FALSE
"cmet inhibition potentiates the tumor‐selective damaging effects of nqo1‐bioactivatable agents by compromising dna repair","The FASEB Journal",2022,"10.1096/fasebj.2022.36.s1.r4326",FALSE
"the bone-muscle connection in breast cancer: implications and therapeutic strategies to preserve musculoskeletal health.","Breast cancer research : BCR",2022,"10.1186/s13058-022-01576-2",TRUE
"conditional loss of nmp4 in mesenchymal stem progenitor cells enhances pth-induced bone formation.","Journal of bone and mineral research : the official journal of the American Society for Bone and Mineral Research",2022,"10.1002/jbmr.4732",TRUE
"health care workers' perspectives on care for patients with injection drug use associated infective endocarditis (idu-ie).","BMC health services research",2022,"10.1186/s12913-022-08121-z",TRUE
"dual antiplatelet alternatives are associated with increased stroke and death after transcarotid revascularization.","Annals of surgery",2022,"10.1097/sla.0000000000005746",FALSE
"recent advances of deep learning for computational histopathology: principles and applications.","Cancers",2022,"10.3390/cancers14051199",TRUE
"germline mutations in cideb and protection against liver disease.","The New England journal of medicine",2022,"10.1056/nejmoa2117872",TRUE
"synthesis and formulation of [64cu]cu-ptsm for pet perfusion imaging in small animal models.","Applied radiation and isotopes : including data, instrumentation and methods for use in agriculture, industry and medicine",2022,"10.1016/j.apradiso.2022.110119",FALSE
"traumatic brain injury and post-traumatic stress disorder are not associated with alzheimer's disease pathology measured with biomarkers.","Alzheimer's & dementia : the journal of the Alzheimer's Association",2022,"10.1002/alz.12712",TRUE
"expanded luxendin color palette for glp1r detection and visualization in vitro and in vivo.","JACS Au",2022,"10.1021/jacsau.2c00130",TRUE
"large hepatic adenomas and hepatic adenomatosis: a multicenter study of risk factors, interventions, and complications.","The American journal of gastroenterology",2022,"10.14309/ajg.0000000000001743",FALSE
"a discovery-based proteomics approach identifies protein disulphide isomerase (pdia1) as a biomarker of β cell stress in type 1 diabetes.","EBioMedicine",2022,"10.1016/j.ebiom.2022.104379",TRUE
"myeloperoxidase-mediated solution demonstrates rapid virucidal properties against the delta variant of sars-cov-2.","The Journal of hospital infection",2022,"10.1016/j.jhin.2022.02.013",TRUE
"myocardial strain imaging in duchenne muscular dystrophy.","Frontiers in cardiovascular medicine",2022,"10.3389/fcvm.2022.1031205",TRUE
"senescence connects autophagy deficiency to inflammation and tumor progression in the liver.","Cellular and molecular gastroenterology and hepatology",2022,"10.1016/j.jcmgh.2022.04.003",TRUE
"eosinophilic esophagitis symptom scores are high in children without eosinophilic disease.","Journal of pediatric gastroenterology and nutrition",2021,"10.1097/mpg.0000000000003324",TRUE
"treatment of adolescent cannabis use disorders.","Child and adolescent psychiatric clinics of North America",2022,"10.1016/j.chc.2022.07.006",TRUE
"physical activity programming for older adults in assisted living: residents' perspectives.","Western journal of nursing research",2022,"10.1177/01939459221107579",FALSE
"long-term childhood outcomes for babies born at term who were exposed to antenatal corticosteroids.","American journal of obstetrics and gynecology",2022,"10.1016/j.ajog.2022.07.026",TRUE
"chest ct in the evaluation of child abuse - when is it useful?","Child abuse & neglect",2022,"10.1016/j.chiabu.2022.105823",FALSE
"an ethical analysis of endoscopic therapy decision-making in patients with refractory substance use disorder and chronic pancreatitis.","Pancreatology : official journal of the International Association of Pancreatology (IAP) ... [et al.]",2022,"10.1016/j.pan.2022.05.007",TRUE
"blood pressure trajectories and outcomes for veterans presenting at va medical centers with a stroke or transient ischemic attack.","The American journal of medicine",2022,"10.1016/j.amjmed.2022.02.012",TRUE
"physioxia-induced downregulation of tet2 in hematopoietic stem cells contributes to enhanced self-renewal.","Blood",2022,"10.1182/blood.2022015499",TRUE
"selective patella resurfacing in contemporary cruciate retaining and substituting total knee arthroplasty: a matched cohort analysis.","The Journal of arthroplasty",2022,"10.1016/j.arth.2022.10.012",FALSE
"coenzyme q10 and related quinones oxidize h2s to polysulfides and thiosulfate.","Free radical biology & medicine",2022,"10.1016/j.freeradbiomed.2022.02.018",TRUE
"most large colorectal polyps missed by gastroenterology fellows at colonoscopy are sessile serrated lesions.","Endoscopy international open",2022,"10.1055/a-1784-0959",TRUE
"reply to paul and lewis.","Pain",2022,"10.1097/j.pain.0000000000002449",FALSE
"non‐invasive, spatiotemporal characterization of muscle activation patterns from vagus nerve stimulation in human subjects","The FASEB Journal",2022,"10.1096/fasebj.2022.36.s1.r4587",FALSE
"driving adult tissue repair via re-engagement of a pathway required for fetal healing.","Molecular therapy : the journal of the American Society of Gene Therapy",2022,"10.1016/j.ymthe.2022.09.002",TRUE
"understanding the factors that determine a fellow's choice in neonatal-perinatal medicine and how they establish their rank list.","American journal of perinatology",2022,"10.1055/a-1974-9605",FALSE
"cervical cancer development: implications of hpv16 e6e7-nfx1-123 regulated genes.","Cancers",2021,"10.3390/cancers13246182",TRUE
"ampath surgical app: low-cost simulator for the open appendectomy.","Surgery",2022,"10.1016/j.surg.2022.07.023",FALSE
"""a whole new perspective on how the body fits together""-an evaluation of a cadaver laboratory experience for high school students.","Anatomical sciences education",2022,"10.1002/ase.2229",FALSE
"restoring mitochondrial cardiolipin homeostasis reduces cell death and promotes recovery after spinal cord injury.","Cell death & disease",2022,"10.1038/s41419-022-05369-5",TRUE
"evolving concepts in uromodulin biology, physiology, and its role in disease: a tale of two forms.","Hypertension (Dallas, Tex. : 1979)",2022,"10.1161/hypertensionaha.122.18567",TRUE
"the yin and yang of modulating β-cell dna damage response and functional mass.","Diabetes",2022,"10.2337/dbi22-0010",TRUE
"evaluating use of fev1 decline in diagnosis and management of pulmonary exacerbations in children with cystic fibrosis","TP74. TP074 CYSTIC FIBROSIS AND PRIMARY CILIARY DYSKINESIA",2021,"10.1164/ajrccm-conference.2021.203.1_meetingabstracts.a3374",TRUE
"evaluating shared decision-making in postpartum contraceptive counseling using objective structured clinical examinations.","Women's health reports (New Rochelle, N.Y.)",2022,"10.1089/whr.2022.0067",TRUE
"immediate autotransplantation of molars with closed apex.","The Journal of Contemporary Dental Practice",2022,"10.5005/jp-journals-10024-3331",TRUE
"maternal obesity and the impact of associated early-life inflammation on long-term health of offspring.","Frontiers in cellular and infection microbiology",2022,"10.3389/fcimb.2022.940937",TRUE
"the impact of covid-19 on the lgbtq+ community: comparisons between cisgender, heterosexual people, cisgender sexual minority people, and gender minority people.","Psychiatry research",2022,"10.1016/j.psychres.2022.114391",TRUE
"age and sex affect tgfβ2-induced ocular hypertension in c57bl/6j mice.","Experimental eye research",2022,"10.1016/j.exer.2022.109055",TRUE
"patient demographics are associated with differences in prehospital pain management among trauma patients.","Prehospital emergency care",2022,"10.1080/10903127.2022.2132565",FALSE
"cover image, volume 93, number 12, december 2021","Journal of Medical Virology",2021,"10.1002/jmv.27388",FALSE
"using 2-photon microscopy to quantify the effects of chronic unilateral ureteral obstruction on glomerular processes.","Journal of visualized experiments : JoVE",2022,"10.3791/63329",TRUE
"fingolimod in combination with bortezomib demonstrates synergistic tumor inhibition and bone anabolic effects in myeloma bone disease","Blood",2022,"10.1182/blood-2022-171069",TRUE
"use of a nanofiber resorbable scaffold during rotator cuff repair: surgical technique and results after repair of small- to medium-sized tears.","Orthopaedic journal of sports medicine",2022,"10.1177/23259671221094848",TRUE
"the role of fluorescence in situ hybridization in pancreatobiliary brushing cytology: a large retrospective review with histologic correlation.","Diagnostics (Basel, Switzerland)",2022,"10.3390/diagnostics12102486",TRUE
"recovery of highly functional human hematopoietic stem and progenitor cells from 27-year old cryopreserved umbilical cord blood","Blood",2022,"10.1182/blood-2022-170272",FALSE
"asparagine bioavailability regulates the translation of myc oncogene.","Oncogene",2022,"10.1038/s41388-022-02474-9",TRUE
"a new perspective on no pathway in sepsis and adma lowering as a potential therapeutic approach.","Critical care (London, England)",2022,"10.1186/s13054-022-04075-0",TRUE
"erratum to 'blood pressure trajectories and outcomes for veterans presenting at va medical centers with a stroke or transient ischemic attack' the american journal of medicine, volume 135 (2022), issue 7, 889-896.e1.","The American journal of medicine",2022,"10.1016/j.amjmed.2022.11.003",TRUE
"prepontine shunting for pseudotumor cerebri in previously failed shunt patients: a 5-year analysis.","Neurosurgery",2021,"10.1093/neuros/nyaa417",FALSE
"descriptive analysis of emergency medical services 72-hour repeat patient encounters in a single, urban agency.","The American journal of emergency medicine",2022,"10.1016/j.ajem.2022.12.025",FALSE
"systematic review of frequency of felt and enacted stigma in epilepsy and determining factors and attitudes toward persons living with epilepsy-report from the international league against epilepsy task force on stigma in epilepsy.","Epilepsia",2022,"10.1111/epi.17135",TRUE
"radiologists staunchly support patient safety and autonomy, in opposition to the scotus draft.","Clinical imaging",2022,"10.1016/j.clinimag.2022.05.012",FALSE
"the unfolded protein response regulates er‐phagy in fibrogenic hepatic stellate cells","The FASEB Journal",2022,"10.1096/fasebj.2022.36.s1.r4963",FALSE
"tissue transglutaminase activates integrin-linked kinase and β-catenin in ovarian cancer.","The Journal of biological chemistry",2022,"10.1016/j.jbc.2022.102242",TRUE
"the structural mechanism of human glycogen synthesis by the gys1-gyg1 complex.","Cell reports",2022,"10.1016/j.celrep.2022.111041",TRUE
"fast and high-throughput lc-ms characterization, and peptide mapping of engineered aav capsids using lc-ms/ms.","Molecular therapy. Methods & clinical development",2022,"10.1016/j.omtm.2022.09.008",TRUE
"measures of intracranial injury size do not improve clinical decision making for children with mild traumatic brain injuries and intracranial injuries.","Neurosurgery",2022,"10.1227/neu.0000000000001895",TRUE
"cortical porosity is elevated after a single dose of zoledronate in two rodent models of chronic kidney disease.","Bone reports",2022,"10.1016/j.bonr.2022.101174",TRUE
"the reduction of astrocytic tau prevents amyloid-β-induced synaptotoxicity.","Brain communications",2022,"10.1093/braincomms/fcac235",TRUE
"hemodynamic profiles by non-invasive monitoring of cardiac index and vascular tone in acute heart failure patients in the emergency department: external validation and clinical outcomes.","PloS one",2022,"10.1371/journal.pone.0265895",TRUE
"trial of erythropoietin for hypoxic-ischemic encephalopathy in newborns.","The New England journal of medicine",2022,"10.1056/nejmoa2119660",TRUE
"novel insight into the role of clusterin on intraocular pressure regulation by modifying actin polymerization and extracellular matrix remodeling in the trabecular meshwork.","Journal of cellular physiology",2022,"10.1002/jcp.30769",TRUE
"'i bring her up with love:' perspectives of caregivers of children with neurodevelopmental delays in western kenya.","Child: care, health and development",2022,"10.1111/cch.13033",TRUE
"microfluidics guided by deep learning for cancer immunotherapy screening.","Proceedings of the National Academy of Sciences of the United States of America",2022,"10.1073/pnas.2214569119",TRUE
"the protection conferred by hsd17b13 rs72613567 on hepatic fibrosis is likely mediated by lowering ballooning and portal inflammation.","Clinical gastroenterology and hepatology : the official clinical practice journal of the American Gastroenterological Association",2022,"10.1016/j.cgh.2022.11.002",TRUE
"single-cell analysis of a high-grade serous ovarian cancer cell line reveals transcriptomic changes and cell subpopulations sensitive to epigenetic combination treatment.","PloS one",2022,"10.1371/journal.pone.0271584",TRUE
"ad informer set: chemical tools to facilitate alzheimer's disease drug discovery.","Alzheimer's & dementia (New York, N. Y.)",2022,"10.1002/trc2.12246",TRUE
"plcg2m28l interacts with high fat/high sugar diet to accelerate alzheimer's disease-relevant phenotypes in mice.","Frontiers in aging neuroscience",2022,"10.3389/fnagi.2022.886575",TRUE
"design and implementation of a basic and global point of care ultrasound (pocus) certification curriculum for emergency medicine faculty.","The ultrasound journal",2022,"10.1186/s13089-022-00260-y",TRUE
"literature review for office-based anesthesia.","Anesthesia progress",2022,"10.2344/anpr-69-02-14",TRUE
"soft self-expandable metal stent to treat painful pancreatic duct strictures secondary to chronic pancreatitis: a prospective multicenter trial.","Gastrointestinal endoscopy",2022,"10.1016/j.gie.2022.09.021",TRUE
"impact of including epinephrine in the submucosal injectate for colorectal emr on postprocedural pain: a randomized controlled trial.","Gastrointestinal endoscopy",2021,"10.1016/j.gie.2021.11.043",FALSE
"chemically-defined generation of human hemogenic endothelium and definitive hematopoietic progenitor cells.","Biomaterials",2022,"10.1016/j.biomaterials.2022.121569",TRUE
"current perspectives of neuroendocrine regulation in liver fibrosis.","Cells",2022,"10.3390/cells11233783",TRUE
"comparison of breast reconstruction outcomes using oxychlorosene versus triple antibiotic solution for pocket irrigation.","Plastic and reconstructive surgery. Global open",2022,"10.1097/gox.0000000000003975",TRUE
"low-flow acute kidney injury: the pathophysiology of prerenal azotemia, abdominal compartment syndrome, and obstructive uropathy.","Clinical journal of the American Society of Nephrology : CJASN",2022,"10.2215/cjn.15341121",TRUE
"clinical, pathologic, and molecular-genetic aspects of colorectal polyps.","Gastrointestinal endoscopy clinics of North America",2022,"10.1016/j.giec.2021.12.007",FALSE
"systemic effects of bmp2 treatment of fractures on non-injured skeletal sites during spaceflight.","Frontiers in endocrinology",2022,"10.3389/fendo.2022.910901",TRUE
"correction: mysore et al. a broad-based mosquito yeast interfering rna pesticide targeting rbfox1 represses notch signaling and kills both larvae and adult mosquitoes. pathogens 2021, 10, 1251.","Pathogens (Basel, Switzerland)",2022,"10.3390/pathogens11090956",TRUE
"liquid chromatography method for simultaneous quantification of atp and its degradation products compatible with both uv-vis and mass spectrometry.","Journal of chromatography. B, Analytical technologies in the biomedical and life sciences",2022,"10.1016/j.jchromb.2022.123351",TRUE
"exploiting deep transfer learning for the prediction of functional non-coding variants using genomic sequence.","Bioinformatics (Oxford, England)",2022,"10.1093/bioinformatics/btac214",TRUE
"transcarotid artery revascularization is safe in necks with anatomy hostile for carotid endarterectomy.","Journal of vascular surgery",2022,"10.1016/j.jvs.2022.04.030",TRUE
"the <i>in vitro</i> and <i>in vivo</i> effects of dpp-4 inhibition with sitagliptin, alone and in combination with bortezomib, on t cell activation: rationale for gvhd prevention","Blood",2022,"10.1182/blood-2022-163679",TRUE
"a framework for a consistent and reproducible evaluation of manual review for patient matching algorithms.","Journal of the American Medical Informatics Association : JAMIA",2022,"10.1093/jamia/ocac175",TRUE
"intravital multiphoton microscopy as a tool for studying renal physiology, pathophysiology and therapeutics.","Frontiers in physiology",2022,"10.3389/fphys.2022.827280",TRUE
"integrative analysis of dna methylation and gene expression identifies genes associated with biological aging in alzheimer's disease.","Alzheimer's & dementia (Amsterdam, Netherlands)",2022,"10.1002/dad2.12354",TRUE
"patients asking about apoe gene test results? here's what to tell them.","The Journal of family practice",2022,"10.12788/jfp.0397",TRUE
"the effects of taurocholic acid on biliary damage and liver fibrosis are mediated by calcitonin-gene-related peptide signaling.","Cells",2022,"10.3390/cells11091591",TRUE
"bioactivity of dental restorative materials: fdi policy statement.","International dental journal",2022,"10.1016/j.identj.2022.11.012",TRUE
"patients generally may return to driving 4 weeks after hip arthroscopy and 6 weeks after knee arthroscopy: a systematic review and meta-analysis.","Arthroscopy, sports medicine, and rehabilitation",2021,"10.1016/j.asmr.2021.08.015",TRUE
"a non-coding gwas variant impacts anthracycline-induced cardiotoxic phenotypes in human ipsc-derived cardiomyocytes.","Nature communications",2022,"10.1038/s41467-022-34917-y",TRUE
"cortical porosity occurs at varying degrees throughout the skeleton in rats with chronic kidney disease.","Bone reports",2022,"10.1016/j.bonr.2022.101612",TRUE
"response to comment on dunne et al. the women's leadership gap in diabetes: a call for equity and excellence. diabetes care 2021;44:1734-1743.","Diabetes care",2022,"10.2337/dci21-0055",TRUE
"the kidney protects against sepsis by producing systemic uromodulin.","American journal of physiology. Renal physiology",2022,"10.1152/ajprenal.00146.2022",TRUE
"evaluation of the cost-effectiveness of surgical treatment options for benign prostatic hyperplasia.","Urology",2022,"10.1016/j.urology.2022.09.026",FALSE
"health supervision for children and adolescents with down syndrome.","Pediatrics",2022,"10.1542/peds.2022-057010",FALSE
"a novel qualitative approach for identifying effective communication for recruitment of minority women to a breast cancer prevention study.","Contemporary clinical trials communications",2022,"10.1016/j.conctc.2022.100910",TRUE
"a conserved female-specific requirement for the ggt gene in mosquito larvae facilitates rnai-mediated sex separation in multiple species of disease vector mosquitoes.","Pathogens (Basel, Switzerland)",2022,"10.3390/pathogens11020169",TRUE
